char_name|char_id|unprocessed_line|processed_line
CHANDLER|0|And uh, I've been holding off on asking her out in the past, because she has an unusually large head|and uh i have been holding off on asking her out in the past because she has an unusually large head
CHANDLER|0|But, I'm not gonna let that stuff hang me up anymore|but i am not gonna let that stuff hang me up anymore
CHANDLER|0|Look at me|look at me
CHANDLER|0|I'm growing|i am growing
JOEY|0|Hey, uh, you can't recycle yearbooks, can you|hey uh you cannot recycle yearbooks can you
CHANDLER|0|I'll take that|i will take that
JOEY|0|You want his yearbook|you want his yearbook
CHANDLER|0|Yeah, yeah|yeah yeah
CHANDLER|0|Some people said some nice things about him|some people said some nice things about him
CHANDLER|0|I think somebody should have it|i think somebody should have it
MONICA|0|Oh, gosh, this is so weird|oh gosh this is so weird
MONICA|0|I mean, his whole life was in this apartment, and now it's gone|i mean his whole life was in this apartment and now it is gone
MONICA|0|You know, I think it would be nice if we just took a few moments, for Mr|you know i think it would be nice if we just took a few moments for mr
MONICA|0|Heckles|heckles
MONICA|0|I mean, he was kind of a pain, he was, but, he was a person|i mean he was kind of a pain he was but he was a person
MONICA|0|You're all going to hell|you are all going to hell
RACHEL|0|It's really not that big|it is really not that big
CHANDLER|0|Takin' that with you, huh|takin that with you huh
JOEY|0|Oh, yeah|oh yeah
ROSS|0|You comin'|you comin
CHANDLER|0|Yeah, jus' second|yeah jus second
CHANDLER|0|Good-bye Mr|good bye mr
CHANDLER|0|Heckles|heckles
CHANDLER|0|We'll try to keep it down|we will try to keep it down
ALISON|0|Oh, my major was totally useless|oh my major was totally useless
ALISON|0|"I mean, how often do you look in the classifieds and see ""Philosopher wanted"""|i mean how often do you look in the classifieds and see philosopher wanted
CHANDLER|0|Sure|sure
