Ross| Ohh, here's that Macadamia nut!
Rachel| Ohhh!!
Ross|  Nope! Something else. 
Rachel| Oops! All right, so what do you want to do now?
Ross| I wanna get out of the room! Y'know, I…I really miss downstairs.
Rachel| Okay, y'know what? There's only one way I'm leaving this hotel room.
Ross| Well hello! I'm Ross!
Rachel| Good luck to ya!
Ross| Excuse me sir, you've got a little something right here. 
Rachel| Wow!
Ross|  Hello!
Rachel|  Hello!
Ross|
Rachel|
Phoebe| I won! I won! I finally won!
The Lurker| I won! That was my quarter!
Phoebe| Fine! Here! Take a hike toots! 
The Lurker|  Excuse me, sir! This lady played my quarter, this is my money. 
The Security Guard|  Is that true miss?
Phoebe|  Sells drugs to kids.
The Security Guard| What?!
Phoebe| She sells drugs to kids. 
The Lurker| It was my quarter!
The Security Guard|  Was it her quarter?
Phoebe| How about we talk about this over dinner?
The Security Guard| Okay lady, you're out of here.
Phoebe| No! No, you can't arrest me! No!! I won't go back! I won't go back to that hell hole!!
The Security Guard| I'm just taking you outside!
Phoebe| Oh, okay. 
Monica| Okay, come on, I can't get married until I get something old, something new, something borrowed, and something blue.
Chandler| Okay, all right, all right, all right! Okay!  Okay, here's something, here's something blue and new.
Monica| You're so efficient. I love you! 
Chandler| Let's go! 
Monica| No-no-no! We need something old!
Chandler| Ohh, great, I have condom in my wallet I've had since I was twelve.
Monica| That'll work!
Chandler| I don't think so.
Monica| Okay, now we just need something borrowed!
Chandler|  Here just…take this. 
Monica| That's stealing!
Chandler| No, we'll-we'll bring it back! Just put it under your dress.
Monica| Ohh. 
Chandler| Okay, one thing at a time. 
Joey|  Ahhh! 
Joey's Hand Twin| Are you gonna play?
Joey| No-no, I don't really have any money. Not yet, anyway… 
Joey's Hand Twin| You can't sit here if you're not gonna play.
Joey|  Ooh-ho-ho! 
Phoebe|  Hello. My name is Regina Phalange. I'm a businesswoman in town on business. Would you like to see my card?  Ooh, what did I do with my file-a-facts? I must've left it in conference room B.
Joey's Hand Twin|  14.
Joey| Hit me! 
Phoebe| Oh my God! May I just say that you two gentlemen have the exact same hands! They're identical! Now, I've never seen anything like that in the business world.
Joey's Hand Twin| Stop it!
Joey| Uhh, Ms. Phalange, may I ask you a question as an impartial person at-at this table?
Joey's Hand Twin| Please stop it!
Joey| Wouldn't you pay good money to see these identical hands showcased in some type of a uh, entertainment venue?
Joey's Hand Twin|  If you leave now, I will chop off my hand and give it too you!
The Security Guard|  Didn't I just throw you out of here?
Phoebe| No, you threw out Phoebe. I'm Ms. Regina Phalange. Phalange!
The Security Guard| Come on, lady! 
Joey's Hand Twin| Please, please take him too. 
Joey| Me?! Oh come on, man! You can't do this! Come on!  I'm your hand twin!!
Chandler| Hello! One marriage please!
Monica| Yep, we wanna get married! 
The Attendant| Well, there's a service in progress. Have a seat.
Chandler|
Monica|
Chandler|  Dum! Dum-dum-dum! Dum! Dum! Dum! Dum-dum-dum!
Monica| What are you doing?
Chandler| Oh, that's The Wedding March. Does, does that freak you out?
Monica| No, only because that's the graduation song.
Chandler| Okay!  This is it!  We're gonna get married!
Monica| Are you sure you wanna do this?
Ross| Well, hello, Mrs. Ross! 
Rachel| Well, hello, Mr. Rachel! 
Rachel| Wait!  Okay!
