other|can't get the monkey off your back
other|then put it in your mouth
other|with monkeyshine beer
other|monkeyshine beer 'cause it's a jungle out there
other| 
ross|that commercial always makes me so sad
joey|yeah but then the guy opens his beer and those girls run at him so everything seems to work out ok
ross|i meant because the monkey in it reminds me of marcel
phoebe|i can see that 'cause they both have those big brown eyes and ya know the little pouty chin
phoebe|monica and the fact that they're both monkeys
ross|sometimes i wonder if i did the right thing ya know giving him away
rachel|oh ross you had to i mean he was humping everything in sight
rachel|i mean i have a malibu barbi that will no longer be wearing white to her wedding
ross|remember when sometimes he'd borrow your hat and and when you got it back there'd be little monkey raisins in it
chandler|yeah well sure when he did it it was funny
chandler|when i did it to my boss's hat
chandler|all of the sudden i have this big attitude problem
joey|hey hey check it out guess what i got
chandler|rhythm
joey|no my first fan mail
monica|'dear dr
monica|remore know that i love you and would do anything to have you
monica|' gosh
monica|'your not so secretive admirer erica ford
monica|' ooh wait 'ps enclosed please find 14 of my eyelashes
monica|'
rachel|ya know in crazy world that means you're married
monica|this wasn't addressed to days of our lives this is this came to your apartment
monica|there's no stamp on it this woman was in our building
joey|oh my god i got my very own stalker
ross|hey guys
phoebe|ooh where are you off to travelin' jake
ross|well there's this uh paleontology conference in l
ross|a
ross|so i figured i'd go and then drive down to the zoo and surprise marcel
chandler|you know i think he will be surprised 'till he realizes he's a monkey and uh you know isn't capable of that emotion
rachel|oh phoebe that really cute guy is here again
phoebe|oh oh ok so everyone pretend like i'm telling you a story ok
phoebe|and and it's really funny
phoebe|so everyone just laugh now
phoebe|i know i know
phoebe|hello
other|hi
other|i'm rob dohnen
phoebe|hi rob dohnen
other|i don't know anything about music but i think you're really really great
phoebe|oh wow
other|anyway i schedule performers for the childrens libraries around the city and i was just thinking have you ever thought about playing your songs for kids
phoebe|oh i would love to have kids
phoebe|you're you're the you're me play the songs that i will write for them
joey|hey whaddya wanna do for dinner
chandler|well we could just stay in and cook for ourselves
chandler|hello
other|it's erica
joey|ah the stalker
other|never mind it's open
chandler|yes hitting her with a frying pan's a good idea
chandler|we might wanna have a backup plan though just in case she isn't a cartoon
joey|let's get out of here
chandler|the one time they're not home
joey|ok we'll just leave and when we pass her on the stairs she won't know it's me 'cause we've never met
joey|chandler that's how radio stars escape stalkers
joey|she's comin'
other|it's me
joey|uhh this is it this is how we're gonna die
joey|ready
chandler|wait wait wait
other|hi
joey|erica
other|hi dean lipson zoo administrator
other|i was told you had a question
ross|well i uh i can't seem to find the monkey i donated last year
ross|he's a capuchan answers to the name marcel
other|ahh i'm afraid i have some bad news
other|marcel has passed on
ross|oh my god what happened
other|well he got sick and then he got sicker and then he got a little better but then he died
ross|i can't believe this
other|i'm sorry mr
other|geller
other|but ya know there's an old saying 'sometimes monkeys die
other|' it's not a great saying but it certainly is fitting today
ross|well ya know someone should have called me
other|i'm sorry
other|look i know this can't bring him back but here it's just a gesture
ross|zoo dollars
other|yes and come see the bird show at 4
other|the macaws wear hats
other|well it's a lot cuter if your monkey hasn't just died
other|ooohhh
phoebe|i know
monica|i can't believe joey's having lunch with his stalker
monica|what i what is she like
chandler|well you remember cathy bates in misery
other|yeah
chandler|well she looks the exact opposite of that
rachel|and she's not crazy
chandler|oh no no no she's a total wack job
chandler|yeah she thinks that joey is actually dr
chandler|drake remore
rachel|oh my god
monica|ah and i mean he's going out with her
monica|he can not persue this
chandler|hey just because this woman thinks she can actually see joey through the magical box in her living room doesn't mean she's not a person
chandler|i mean does she not deserve happiness does she not deserve love
chandler|what're you lookin' at me for
chandler|he's the one who wants to boff the maniac
other|you ok
phoebe|no uh uh i'm just i'm nervous
phoebe|so you know what maybe if i just if i picture them all in their underwear
other|that's not a good idea that's kinda the reason the last guy got fired
phoebe|i'm just i'm i'm i'm used to playing for grown ups
phoebe|ya know they just grown ups drink their coffee and do their grown up thing ya know and kids listen
phoebe|this is a huge responsibility
phoebe|what
phoebe|are you gonna kiss me
ross|i was thinkin' about it
phoebe|ok
phoebe|ok alrighty let's play some tunes
phoebe|hi everybody i'm phoebe
phoebe|ok um i'm gonna play um some songs about grandparents ok
phoebe|now grandma's a person who everyone likes she bought you a train and a bright shiny bike
phoebe|but lately she hasn't been coming to dinner and last time you saw her she looked so much thinner
phoebe|now your mom and your dad said she moved to peru but the truth is she died and some day you will too
phoebe|la la la la la la la la la la la la
other|oh drake isn't it amazing
joey|yeah it is
joey|what
other|well here we sit devil may care just a little while ago you were reattaching someone's spinal cord
joey|yeah that was a tricky one
joey|in reality that operation takes like over 10 hours but they only showed it for 2 minites
other|who's they
joey|no one
other|oh drake you are so talented let me see those hands
other|oh these hands these beautiful hands oh i could just eat them
other|but i won't
joey|good otherwise my watch would fall off
other|no seriously
other|these hands
other|these miracle magical life giving hands
other|oh just to be near them touch them maybe even lick one
joey|alright just one
joey|wow you're good at that
other|oh my god
other|someone he's choking
other|is anyone here a doctor
other|well yes yes the best doctor in all of salem dr
other|drake remore
other|meet me in the nocturnal house in 15 minutes
ross|uhh hey look i don't really enjoy being with other men that way
ross|but um zoo dollars
other|it's about your monkey
other|it's alive
other|i don't understand why didn't you help that man
joey|uhh cause uhh i'm a neurosurgeon and that was clearly a case of uh uh foodal chokage
joey|alright look i got to tell you something
other|no no no no you don't have to tell me anything
other|you don't have to explain yourself to me
other|ooh who am i to question the great dr
other|drake remore
joey|but that's what
other|i should just be happy to be near you
joey|hey i 
other|hey what
joey|that's it just hey
joey|like at the end of a dance hey
joey|hey
joey|he hey
phoebe|there'll be times when you get olderwhen you'll want to sleep with peoplejust to make them like you
phoebe|but don't
phoebe|cause that's another thing that you don't wanna do everybodythat's another thing that you don't wanna do
monica|excellent
chandler|very informative
rachel|not at all inappropriate
phoebe|thank you for coming everybody
phoebe|there're cookies in the back
other|that was great the kids loved you
phoebe|yay i rock
other|and you know why
other|because you told the truth and nobody ever tells kids the truth
other|you were incredible
phoebe|but
other|how did you know there was a but
phoebe|i sense these things
phoebe|it was either but or butter
other|the thing is i think some of the parents they were kinda hopin' that you'd play more songs about like barnyard animals
phoebe|i can do that
other|really
phoebe|yeah
other|because that would be fantastic
other|what
other|you wanna kiss me
phoebe|thinkin' about it
other|ahh the bat
other|ambassador of darkness flitting out of his cave like a winged messenger sightless spectre of the macabe
ross|buddy my monkey
other|oh yeah right
other|there was a break in few months back inside job
other|your monkey was taken
ross|oh my god
ross|but the zoo told me that my monkey was dead
other|the zoo
other|do you believe everything the zoo tells ya
ross|that that's the only thing the zoo's ever told me
other|of course they're gonna say he's dead
other|they don't want the bad publicity
other|it's all a great big cover up
other|do you have any idea how high up this thing goes
ross|that guy lipson
other|lipson knows
other|do you have any idea who else knows
ross|no i i only know lipson
other|hmm lipson knows huh
other|ahh hello mr
other|opossum enigma of the trees upside down denizen of the night taunting gravity with
ross|buddy my monkey my monkey
other|word on the street well when i say street i mean those little pretend streets they have here at the zoo
ross|of course
other|your monkey found a new career in the entertainment field
other|that's all i know
ross|this is unbelievable
other|so what is this information worth to you my friend
ross|are you trying to get me to bribe you
other|maybe
ross|but you already told me everything
ross|check it out he actually is the monkeyshine monkey
rachel|well so what're you gonna do
ross|well i guess i'm gonna call the beer company and try to find out where he is
chandler|that's what i did when i lost my clydesdales
phoebe|ok hi again
phoebe|today we're gonna start with some songs about barnyard animals
phoebe|oh the cow in the meadow goes moo oh the cow in the meadow goes moo
phoebe|then the farmer hits him on the head and grinds him up and that's how we get hamburgers
phoebe|nooowww chickens
other|you're the only one who can save her drake
other|damnit i'm a doctor i'm not god
ross|well there goes my whole belief system
other|it's erica
joey|oh my god quick turn off the tv
rachel|no no no wait i wanna see what happens
joey|uh i get leslie out of the coma and then we make out
rachel|well how can that be you were just kissing sabrina
monica|rachel it's a world where joey is a neuro surgeon
joey|hey erica c'mon in
other|how did you get here so fast i just saw you in salem
joey|right they uh they choppered me in
joey|what's up
other|ohh and i see you're having a little party too
other|is she here huh huh
joey|who
other|sabrina
other|i know about you two
other|i saw you today kissing in the doctor's lounge
joey|it's not what you think that was
other|you told me i was the only one
joey|alright look that's it
joey|i don't think we should see each other anymore alright
joey|look i know i should have told you this a long time ago but i am not drake remore ok
joey|i'm not even a doctor i'm an actor
joey|i just pretend to be a doctor
other|oh my god
other|do the people at the hospital know about this
joey|somebody wanna help me out here
rachel|oh i know i know
other|how how can you be here and there
joey|'cause it's a television show
other|drake what're you getting at
joey|i'm not drake
ross|that's right he's not drake he's hans remore drake's evil twin
other|is this true
rachel|yes yes it is true
rachel|and i know this because because he pretended to be drake to to sleep with me
monica|and then he told me he would run away with me and he didn't
chandler|and you left the toilet seat up you b st rd
other|is all this true
joey|yes i'm afraid it is
joey|you deserve much better than me erica
joey|you deserve to be with the real drake he's the one you fell in love with
joey|go to salem find him he's the guy for you
other|oh hans
ross|hans
ross|hans
ross|yo evil twin
joey|right
joey|goodbye erica good luck in salem
joey|take care
other|i'll never forget you hans
joey|ok alright the people who threw the water
phoebe|fired
phoebe|why
other|the library board has had a lot of complaints from parents about some of the stuff in your songs
phoebe|i can't believe it
phoebe|did you tell your board about how kids want to hear the truth
other|no
phoebe|i see
other|maybe if you just played some regular kiddie songs
phoebe|no
phoebe|what do you what do you want me to be like some stupid big like purple dinosaur
other|i'm not saying you have to be barney
phoebe|who's barney
ross|well i tracked down marcel and get this he's healthy he's happy and he's right here in new york filming outbreak ii the virus takes manhattan
rachel|you're kidding
joey|this is amazing
ross|i know
joey|i finally get a part on tv and the monkey's makin' movies
phoebe|ok rachel i'm ready
rachel|ok
other|excuse me
other|is this where the singing lady is that tells the truth
phoebe|um yeah i guess that's me
other|she's here
phoebe|sometimes men love women sometimes men love men and then there are bisexuals though some just say they're kidding themselves
phoebe|la la la la la la la la la la la
ross|this is so exciting i haven't seen my monkey in almost a year
chandler|what you never look down in the shower
chandler|oh please
chandler|i'm not allowed to make one joke in the monkey is penis genre
other|c'mon people back up please back up c'mon c'mon c'mon c'mon
ross|uh excuse me uh where can we find the monkey
other|i'm sorry guys closed set
ross|uh i'm sorry you don't understand i'm i'm i'm a friend of his
ross|we uh we used to live together
other|yeah and i have a time share in the pocanos with flipper
monica|ross there he is
ross|hey hey buddy marcel
ross|marcel
ross|in the jungle the mighty jungle the lion sleeps tonight
ross|in the jungle the mighty jungle the lion sleeps tonight
ross|a weema way a weema way
other|uh excuse me folks this is a uhh
joey|closed set
joey|we know but we're friends with the monkey
ross|good morning
ross|hey pal look who i brought
ross|it's your old friend harry elefante
joey|woah dude burn
ross|i don't get it he seemed so happy to see me yesterday
other|hey don't take it personal he's under a lot of pressure ya know starring in a movie and all
rachel|now just how big of a star is marcel
other|in human terms i'd say cybill shepard
chandler|so are you guys in the movie or are you just really paranoid
other|hey sal jerry wants to know if the monkey's ready for the subway set
joey|uh excuse me
joey|jerry is the director which one's he
other|the one in the director's chair
joey|gotcha
joey|phoebs walk with me
phoebe|ok
phoebe|um how come i'm walking with you
joey|well we're we're just goin' over here so that we can get away from the horrible flesh eating virus for the love of god woman listen to me
joey|is he lookin' is he lookin'
other|we've got a problem
other|tell me
other|i can't do chris's makeup
other|she refuses to acknowledge that she has a moustasche
other|is it bad
other|it looks like one of her eyebrows fell down
other|now unless someone convinces her to let me bleach it jean claude van damme is gonna be making out with gabe kaplan
other|i'll talk to her
other|i hate actors
chandler|nice camoflauge man for a minute there i almost didn't see ya
other|excuse me
chandler|ahhhh
other|uh is your name chandler
chandler|uh yes yes it is
other|chandler bing
chandler|do you know me or are you just really good at this game
other|i'm susie moss
other|fourth grade glasses i used to carry around a box of animal crackers like a purse
other|chandler susie moss right yeah wow you look
other|great job growing up
other|it's nice to see you're not still wearing that denim cap with all the little mirrors on it
chandler|oh right well yeah i graduated fourth grade and realized i wasn't a pimp
other|remember the class play
other|you you pulled up my skirt and the entire auditorium saw my underpants
chandler|yes back then i uh used humor as a defense mechanism
chandler|thank god i don't do that anymore
monica|oh my god oh my god oh my god
rachel|what what what what
monica|jean claude van damme
monica|i didn't know he was in this movie he is so hot
rachel|ya think
monica|the muscles from brussels wham bam van damme did you see time cop
rachel|no was he any good in it
monica|rachel he like totally changed time
rachel|wow so why don't you go talk to him
monica|oh yeah
rachel|what so you go over there you tell him you think he's cute what's the worst that could happen
monica|he could hear me
rachel|ok i'm doin' it for ya
monica|oh rachel don't don't you dare don't don't
monica|tell him i cook
rachel|excuse me
rachel|hi
other|hi
rachel|um this is gonna sound kinda goofy but uhhm my friend over there who cooks by the way um she thinks you're cute
other|you don't think i'm cute
rachel|i i don't know um do you think you're cute
rachel|ok we're kinda gettin' off the track here
rachel|um i was supposed to come here and tell you my friend thinks you're cute
rachel|so what should i tell her
other|you can tell her i think her friend is cute
chandler|no stephen hurs was the kid who would eat anything for money david stein was the guy who had no elbows
other|ok well then who was the kid that got caught m st rb t ng
chandler|ok that's not what he was doing
chandler|alright he was looking for his bus money
other|oh that's me i gotta go
chandler|oh uh o ok
other|um so listen how many times am i gonna have to touch you on the arm before you ask me on a date
chandler|well uh let's try one more
chandler|there you go say ernie's 8 o'clock
other|i'll be there and who knows if things go well maybe this time i'll get to see your underwear
chandler|no one was around to hear that
monica|so what'd he say
rachel|agh what a jerk
rachel|i kept talking about you and he kept asking me out
rachel|i mean naturally you know i said no
monica|well thanks anyway
rachel|he just kept asking and asking and asking and asking and asking and asking
monica|rachel if you if you want to go out with him you can
monica|sound like a big jerk to me but if that's what you want to do
rachel|jean claude she said yes i'll see you tonight
rachel|thank you
rachel|and then jean claude took me to that place crossroads and that's where we hung out with drew barrymore
joey|oh man she's so smokin she has got the greatest set of
joey|no guys around huh
rachel|does anybody need anything
monica|oh i'll have an espresso
monica|oh acutally i'll get it
monica|if i ask you to you'll probably end up drinking it yourself
rachel|that is so unfair
phoebe|i know
phoebe|oh like you would drink her coffee after what you did to her with van damme
ross|hey joey i have to cancel racketball for tonight that was marcel's trainer
ross|he's gonna let me have him for a couple of hours
joey|you're blowin' me off for a monkey
ross|hey we can rescedule for saturday
joey|yeah unless you hook up with a bunch of pigeons
chandler|hey stick a fork in me i am done
phoebe|stick a fork what
chandler|like when you're cooking a steak
phoebe|oh ok i don't eat meat
chandler|well then how do you know when vegetables are done
phoebe|well you know you juist you eat them and you can tell
chandler|ok then eat me i'm done
chandler|i've met the perfect woman
chandler|ok we're sitting on her couch we're fooling around and then suddenly she turns to me and says 'do you ever want to do it in an elevator
chandler|'
monica|what did you say
chandler|ahh i believe my exact words were 'flaign en sten'
chandler|i mean i didn't know what to say how do you know if you wanna do it on an elevator
phoebe|oh you just know
other|oh shoot we gotta go got a reservation in 30 minutes
chandler|oh no no no no no no no no no no you see what i had planned shouldn't take more that 2 3 minutes tops
other|oh 200 seconds of passion
other|we gotta go
other|but um here's an idea have you ever worn women's underwear
chandler|well ye yes actually but uh they were my aunt edna's and there were three of us in there
other|well i was thinking it would be um kind of sexy if you wore mine tonight at dinner
chandler|you want me to wear your panties
other|could ya
chandler|well if i was wearing your underwear then uh what would you be wearing
chandler|you're swell
ross|ok got the music got the dinner
ross|oh and check it out i made marcel's favorite dish banannacake
joey|oooh
ross|with mealworms
joey|yaaahhh
joey|ahhh candles
joey|what'dya thinks gonna happen here tonight
ross|hello
ross|oh hi are you on your way ove 
ross|oh
ross|no no i i understand i mean a monkey's gotta work
ross|no it it's no big deal it' not like i uh had anything special planned
ross|yeah ok ok
ross|ok ok bye
phoebe|ok rachel why don't you start talking first
rachel|alright i feel that this is totally unjustified
rachel|she gave me the green light i did nothing but 
rachel|do you think i can't see you in the tv set
phoebe|alright monica if there is something that you would like to share
monica|ya know you had no right to go out with him
rachel|that is the most ridiculous
monica|you sold me out
rachel|i did not sell you out
monica|yes you did
monica|absolutely
rachel|would you let me talk
monica|did you just flick me
rachel|ok well you wouldn't let me finish and i was jus ow
rachel|that hurt
monica|quit flicking
rachel|ow you stop flicking
monica|you flicked me first
phoebe|ok now i'm gonna kick some ass
other|ow
other|ow
other|ow
phoebe|alright now i will let go if you both stop
rachel|oh what do you you want me to stop seeing him is that what you want
monica|uh huh
rachel|you want me to just call him up and tell him that you're seeing him instead
rachel|that's what you want
monica|ok
rachel|oh that's what you want
monica|yes
rachel|fine
monica|fine 
phoebe|there we go
phoebe|you know what if we were in prison you guys would be like my bitches
ross|thanks for letting me tag along tonight you guys
joey|forget about it
other|how you doin there squirmy
chandler|i'm hangin in
chandler|and a little out
joey|so assistant to the director
joey|that's a really exciting job i mean you must have a ton of cool responsibilities
other|i have nothing to do with casting
joey|so what're you guys gonna eat
other|how come all i can think about is putting that ice in my mouth and licking you all over
chandler|because i went to an all boys high school and god is making up for it
other|i want you right here right now
chandler|right now right here
chandler|don't ya think we're in kind of a public plaaaa they do have the shrimp
other|meet me in the bathroom
chandler|i'm going to the bathroom now
other|c'mon
chandler|i can't believe we're doing this
other|alright mister let's see those panties
chandler|alrighty
other|ooh
other|ooh
other|but ya know what would be even sexier
chandler|what
other|if you didn't have your shirt tucked into them
chandler|oh
other|alright
other|now i would like to see you wearing nothing but them
other|take your clothes off
chandler|ok but uh i hope you realize this means we're gonna miss hearing about the specials
other|c'mon hurry hurry
chandler|hey do you want this done quick or do you want this done right
other|alright turn around
other|time to see you from behind
chandler|ok
other|oh somebody's been doing his buns of steel video
chandler|well you want me to uh clench anything or 
chandler|susie
chandler|susie
other|this is for the fourth grade
chandler|huh
chandler|where whaddya mean
other|whaddo i mean
other|whaddya mean whaddo i mean
other|i mean underpants mister that's what i mean
chandler|what what's what you mean
other|my skirt you lifted kids laughing
other|i was susie underpants 'till i was 18
chandler|that was in the fourth grade
chandler|how could you still be upset about that
other|well um why don't you call me in 20 years and tell me if you're still upset about this
chandler|alright i hope you realize you're not getting these underpants back
monica|i can't believe this just like 2 weeks ago i was watching sudden death now i'm on a date with jean claude van damme
monica|can you beat up that guy
monica|can you beat up that guy
other|sure
monica|this is so wild
monica|ya know i gotta admit i was kinda surprised that you agreed to go on a blind date
other|normally i would not do it
monica|well what made you make the exception for me
other|'cause rachel told me uh you were dying to have a threesome with me and uh drew barrymore
other|by the way drew has some groundrules and
monica|say you're sorry
rachel|no
monica|say it
rachel|no
monica|rachel you say you're sorry or your sweater gets it
rachel|ok ok that is my favorite sweater that is my third date sweater
monica|say you're sorry
rachel|ok you wanna play
rachel|ok let's play let's play
monica|what're you gonna do
rachel|you give me back my sweater or it's handbag marinara
monica|you don't have the guts
rachel|oh yeah
rachel|well at least i wasn't too chicken to tell some guy i thought he was cute
phoebe|oh alright stop stop the madness
phoebe|this is crazy
phoebe|who can even remember why this even started in the first place
phoebe|yes that's right
phoebe|but still i look at your purse look at your sweater look at yourselves
monica|i'll help you fix your sweater
rachel|i'll help you throw out your purse
monica|i'm sorry that i made you stop seeing him
rachel|well i'm sorry i went out with him when i knew you liked him
monica|i'm sorry that i borrowed your gloves
chandler|joey
joey|ma
chandler|joey
joey|chandler
joey|what're you still doin' here i though you guys took off
chandler|oh no no no she took off with my clothes
joey|are you naked in there
chandler|not exactly
chandler|i'm wearin panties
joey|huh you uh you always wear panties
chandler|no no this is the first time
joey|wow talk about your bad luck i mean the first time you try panties and someone walks off with your clothes
chandler|i was not trying them out susie asked me to wear them
joey|well let me see
chandler|no
chandler|i'm not letting you or anybody else see ever
