phoebe|oh hey ross oh i'm so glad someone's here could you zip me up
ross|sure
phoebe|thank you
phoebe|can you believe no one between my apartment and here offered to do that for me
ross|people so why you all dressed up
phoebe|oh umm mike's picking me up for a date
ross|oh yea now um how is that going is it getting serious
phoebe|oh i dunno i dunno you know i mean i like him but am i ready to take my grade a loins off the meat market
ross|you know i really admire your whole dating attitude it's so healthy i'm always like is this moving to fast
ross|is this moving to slow
ross|where's this going
phoebe|yea you know you are a bit of a drama queen
ross|but you your so much better off you just go from guy to guy having fun and never worrying that it terns into anything serious
phoebe|i wouldn't say never you know there's that guy well what about ok well there's gotta be someone
ross|there isn't that's what i'm saying
phoebe|oh my god you're right
ross|i know and yet here you are all ready for the next date
phoebe|i can't believe i never realized this before i'm in my thirty's and never been in a long term relationship oh my god what's wrong with me
ross|no no no there's nothing wrong with you i mean you don't strike me as the type of person that wants to get married anyway
phoebe|i wanna get married
ross|please don't cry because of me pheebs i don't know what i'm talking about i've been divorced three times
phoebe|least you've been married oh my god
phoebe|i wanna trade lives with ross
other|phoebe what's wrong
phoebe|nothing i'm excited about our date mike this is ross geller this is mike haaaaa
ross|i'm sorry i didn't catch
other|its mike hanagen
ross|oh ross geller
other|hey so are you sure your ready to go
phoebe|uh huh how do i look
ross|do you have a compact in your purse
phoebe|no
ross|you look great
monica| hey joey
joey|hey this girl won't turn around and i can't tell whether she's hot or not what do you think
monica| joey i am not going to objectify woman with you but if her face is as nice as her ass woah mamma
joey|alright thanks oh hey have you talked to chandler
monica| yeah he has to stay in tulsa this weekend
joey|how come
monica| he has to work there's some rush on the big ah damn it one of these days i'm really gonna have to start listening when he talks about his job
joey|oh why don't you fly out there and surprise him
monica| maybe i will go yea will have a second honeymoon at the tulsa romana
joey|oh and you know what you should bring the black see through teddy with the attached garters
monica| how do you know i have one of those
joey|didn't till just now
joey|hot not hot hot
other|excuse me
joey|i said i think you're hot and now i'm embarrassed
other|oh i thought you said hi
joey|that would've been better i'll try that hi i'm joey
other|i'm hayley
joey|look i don't usually ask out women that i meet in coffeehouses
other|ha
joey|gesundheit
other|i would love to go out with you
joey|really great did i actually ask you
other|no that's just where you were going i just figured that i'd help you out you don't seem like the kind of guy that does this very a lot
other|ha
joey|seriously gunther you should see someone about that cold if it gets much worse you could die
ross|so how'd the date go
phoebe|well it was awful every time i thought about what you said i started crying
ross|so he hasn't called
phoebe|would you call this girl
phoebe|thanks fo r a love ly even ing
ross|now i feel terrible this is all my fault
phoebe|well you not what you should feel terrible about this could have been my serious guy he was sweet and smart and funny
phoebe|do you know how hard it is to meet a guy like that
ross|we are a rare breed
other|what a great dinner
joey|yeah and hey thanks again for letting me having that last piece of cake at the restaurant
other|your welcome again i'm gonna make some coffee can i get you anything
joey|do you have any cake
joey|awch
joey|that's why
ross|hey mike sorry to just drop by like this can i come in
other|sure who are you
ross|i'm ross phoebe's friend from the coffeehouse
other|oh
ross|yeah i really really need to talk to you about something
other|ok unless you're not gonna try to get me to join a cult are you
ross|no
other|oh it's just you have that look
ross|damn super cuts
other|what's up is phoebe ok
ross|oh no yeah no phoebe is great but umm i'm an idiot look right before you guys went out i accidentally got her all upset
other|that's why she was weird
ross|yes yeah i said something stupid about her never having had a serious relationship but you should know she is so much fun a wonderful person please don't blow her off
other|i'm not blowing her off i actually just got off the phone with her were going out tomorrow night i mean i hope that's ok with you stranger from the coffee house
ross|well then i didn't need to bother you or the four other mike hanagens i bothered
other|hey wait wait wait wait wait
other|is that true what you said phoebe's never had a serious relationship
ross|of course she has
ross|if she'd never had a serious relationship i'd go round broadcasting it like some unstoppable moron
other|but you did say it
ross|yes yes i did
ross|and i will also say what i'm about to say vis � vis the following phoebe has never had a serious relationship since her
ross|super serious relationship with
ross|vicrum
other|vicrum
ross|what that's a real name
chandler|oklahoma where the wind comes sweeping down the plane stop it
chandler|why couldn't they have sent me to texas
chandler|7 o clock maybe i'll hit the gym who am i kidding pay per view p0rn
chandler|do not disturb do not disturb
chandler|monica 
monica| is everything all right
chandler|everything's great just watching some regular television there what a pleasant surprise
monica| i'm gonna go freshen up ok
chandler|ok honey
chandler|that was close
rachel|hello
monica| hey rach its me ok i just got the chandler's room and i caught him molesting himself
rachel|oh that couldn't have been pretty
rachel|but you know guys do that
monica| yea well the weird part is
monica|he was getting off to a shark attack show
rachel|nooooooooo
monica| yes
monica|chandler watches shark p0rn
rachel|well watching sharks
rachel|are you sure that's what he was doing
monica| do you know how many times i've seen him jump up like that believe me i know what he was doing
rachel|man sharks
rachel|i always knew there was something weird about that dude
rachel|but you promised to love him no matter what
monica| what means if he gets like a disease or kills someone
monica|not if he gets his jollys to jaws
rachel|ah
rachel|you know what honey guys are just different they like things that we can't understand you know i once dated this guy who wanted to pretend he was an archeologist and i was a naughty cave woman that he unfroze from a block of ice
monica| eww are you talking about my bother
rachel|yeah i didn't disguise that very well did i
joey|hey
rachel|hi
joey|listen to this
joey|i went out with this girl last night and half way through our date i realized i already slept with her
rachel|so basically you've slept with all the woman in new york and now you're just going around again
joey|well that's not even the weird part
joey|i don't think she remembered sleeping with me
monica| but you don't remember sleeping with her
joey|yeah but she should remember sleeping with me i am very memorable you guys know
rachel|what how do we know we never slept with you
joey|and who's fault is that
monica| what's the big deal you forgot she forgot maybe you were having an off night
joey|hey
joey|i never have an off night ok although sometimes when i'm a little bloated i don't feel very sexy but even then i'm better then most
monica| honey why don't you just let it go and ask her out again
rachel|yeah your both so slutty you don't even remember who you've slept with you're made for each other
joey|interesting
joey|all right i'll go out with her again and try to get past it oh salt bloaty
monica| joey joey
joey|what
monica| you don't think sharks are sexy do you
joey|no
joey|wait a minute what was the little mermaid
phoebe|it's open
ross|hey
phoebe|hey
phoebe|mike called were going out again
phoebe|yay
phoebe|yay
ross|yay
ross|quick thing i went to talk to mike
phoebe|what
phoebe|wha wha wha did you do ross
ross|oh boy you got mad at that part
ross|i went over there to tell him how great you are but you know me blah blah blah and i ended up telling him that
phoebe|what
ross|umm
ross|that you had a six year long relationship with a guy named vicrum
phoebe|what
phoebe|why
ross|well he seemed to bum hard that you'd never been in a serious relationship
phoebe|if you hadn't just had a baby with my best friend i swear to lucifer a raber dog would be feasting on your danglers right now
ross|well phoebe i think you'll feel better when you know a little bit about vicrum his a kite designer and he used to date oprah
phoebe|i'm not going along with some lie you made ross no i'm just gonna be honest with him
ross|good yeah just be honest with him
phoebe|yeah i've nothing to be ashamed of ok so i haven't been in a relationship that lasted longer then a month
phoebe|ok i haven't had a real boyfriend you know if he can't handle that he can leave
phoebe|which he will and that's ok
phoebe|so i'll just be alone forever you know alright i'll be
phoebe|it'll be fine
phoebe|it'll be fine
phoebe|i'll go walking tours with widows and lesbians
phoebe|oh
ross|i'll get it
phoebe|ok
other|you know i'm trying to think of the last time i opened a door and you weren't there phoebe are you ok
phoebe|uh huh yeah there's just something umm there's something you should know vicrum just called
other|so it was kind of a shock after 25 years of marriage my parents a perfect couple getting divorced i kinda took it the hardest cause i was the youngest
joey|uh huh sure yeah
joey|how can you not remember me
other|what
joey|how could you not remember that we slept together
other|what
other|when
joey|i dunno
other|i really really think i would remember sleeping with you
joey|come on come on search your brain all right
joey|it was a certain amount of time ago i was here you were here we had s x here here here not there
joey|anything
other|no it's not ringing any bells
joey|my god woman
joey|how many people do you have to had been with not to remember any of this
other|hey hayley you've really gotta fix that doorknob
other|joey
joey|ooooooooooh i slept with you
joey|and you obviously remember me hey
joey|i still got it
joey|so were good
joey|i'll let myself out
phoebe|and i said vicrum you can't just call every time you get lonely you know you you gave up that right when you slept with rachel
other|but rachel i thought she just had a baby with ross
phoebe|yeah well yeah you know emma's birth certificate might say geller but her eyes say mookurgee
other|that is so wrong and on top of that his a glue sniffer
phoebe|i know but he call's and my heart goes to him
phoebe|you know that b st rd is one smooth talking free lance kite designer
other|i just think there's somebody better out there for you i mean i'm not saying me but
other|maybe me
phoebe|oh
other|and you don't have to worry about glue sniffing with me
other|although i do smell the occasional magic marker yeah ah anyway i just think i can make you happy
phoebe|ok i can't do this
other|what's wrong
phoebe|well there is no vicrum ross made him up because i never really have been in a long term relationship i've never lived with a guy and i've never even celebrated an anniversary so
phoebe|if that's too weird for you and you wanna leave i totally understand
phoebe|in fact i'll close my eye's make it less awkward you kissed me
other|uh huh
phoebe|so you don't think i'm a total freak
other|no
other|well look can i think your weird and also cool for telling me the truth and also wanna kiss you
phoebe|i guess so can i
phoebe|can i think it's cool that you kiss me and also wanna kiss you again and umm be a little concerned about the magic markers
other|definitely
ross|this is vicrum
chandler|hi honey i'm home
monica| hi how was your flight
chandler|oh it was great
monica| here why don't you sit down get yourself comfortable because i
monica|have a little surprise for you
chandler|well well well it must be five in tulsa because it's six o clock in ny
chandler|c
monica| ok this is how much i love you
chandler|honey why am i watching a bunch of sharks swimming around
monica| is this not the good part
monica|do you want me to fast forward to something a little toothier
chandler|no i'm not quite sure you got the right movie that's all
monica| oh well this is the only one they had at our video store but they did have something called crocodile killers
monica|or does it always have to be sharks
chandler|does what always have to be sharks
monica| honey look we can do something else do you want me to get into the tub and thrash
chandler|what's going on
monica| sweetie it's ok i still love you let me be a part of this
chandler|let me be a part of this
monica| i saw what you were doing in tulsa
monica|angry sharks turn you on
chandler|no they don't
monica| then why were you watching them and giving yourself a treat
chandler|oh my god
chandler|when you came in i switched the channel i was just watching regular p0rn
monica| really
chandler|yeah just some good old fashion girl on girl american action
monica| i cannot tell you how happy that makes me
chandler|you are an amazing wife
chandler|no really you're amazing you were actually gonna do this for me i mean where do you find the strength and understanding over something like that
monica| im very very drunk right now
joey|see ordinarily i would talk to her but my confidence is shaken did i sleep with her
joey|did i not sleep with her
phoebe|you know maybe this is a wake up call about your whole dating attitude
phoebe|your in your thirty's and you've never had a serious relationship and you have never been in a long term relationship here you go from woman to woman meaningless experience to meaningless experience never even worrying that it doesn't tern into anything serious
joey|your right
joey|i love my life
joey|i actually did sleep with her
