char|line
monica|hey guys
rachel|hi
phoebe|hey
monica|we need to talk to you about something
chandler|yeah
chandler|we do not feel like we can host thanksgiving this year
phoebe|hey
ross|are you kidding
chandler|well it is just with uhm work and the stress of adoption we just do not feel like we have the energy
chandler|plus we do not think it is fair that every year the burden falls on us
ross|that does not sound like you
ross|that is monica talking
chandler|no no
chandler|we made this decision together
ross|she is putting words in your mouth
joey|do not you put words in peoples mouths you put turkey in peoples mouths
rachel|i cannot believe this
rachel|this is emmas first thanksgiving
monica|no it is not
rachel|it is not
rachel|when was she born
phoebe|well personally i think it is great you are giving yourself a break
monica|thank you pheebs
phoebe|sure
phoebe|it is just as well
phoebe|i mean last year was not very good
phoebe|i think she is losing her touch
monica|what
monica|you are way off lady
phoebe|am i
phoebe|really
phoebe|am i
phoebe|well why do not you cook thanksgiving dinner and prove me wrong
phoebe|well think about it think about it you will be trying to top than you did last year
phoebe|you had be in competition
phoebe|with yourself
monica|that is my favourite kind
monica|okay we are doing this
chandler|do not let yourself get manipulated this way
monica|hey stay out of this chandler
monica|this is between me
monica|and me
chandler|we are supposed to make these decisions together
chandler|did you not watch the doctor phil i taped for you
chandler|opening credits
phoebe|hey
rachel|hi
rachel|happy thanksgiving
phoebe|oh yeah happy needless turkey murder day
monica|you guys i ordered some chocolate pies from that bakery on bleecker
monica|could you pick them up for me
phoebe|you are not making the pies yourself
monica|no no no i do not make chocolate pies
monica|when i was younger i i enter in this pie eating contest
monica|i ate so many that just the thought of them made me sick
rachel|did you at least win the contest
monica|2 minutes 12 pies and a part of one tin
monica|okay i see you guys at 4
rachel|cannot wait
monica|this dinner is gonna be so great
monica|in your face last year me
phoebe|hey rach
rachel|yeah
phoebe|what is emma doing today
rachel|well let us see
rachel|uh
rachel|i know that she has a meeting with her lawyer and then she has to make a very big poop
rachel|why
phoebe|well i wanna enter her in a baby beauty pageant
rachel|oh my god
rachel|that is the creepiest thing ever heard
phoebe|okay but well before you say no my friend susanne is entering her kid and compared to emma she is a real dog
rachel|oh
rachel|phoebe all babies are beautiful
phoebe|oh
phoebe|okay
rachel|phoebe just the idea of pitting one baby against another i mean you know and judging who is cuter just for a trophy
rachel|and a thousand dollars
rachel|is something very interested in
rachel|oh please do not tell ross
rachel|he still believes that what is in the inside is important
phoebe|okay oh and emma needs a cowgirl outfit for the competition
rachel|where am i gonna get a cowgirl outfit on thanksgiving
phoebe|well i was thinking
rachel|oh take the clothes of joeys cabbage patch kid
phoebe|yeah
monica|did someone drop the baton again
chandler|why come all the way from kansas to do that
monica|i do not get older
monica|i just get better
chandler|you know what just occurred to me
chandler|this could be our last thanksgiving just the two of us
chandler|i mean we could be getting a baby soon
monica|you do not know that
chandler|somebody is gonna pick us
monica|yeah but we have not heard a thing from the adoption agency and it has been weeks
chandler|telling ya
chandler|it is gonna happen
chandler|next year it is gonna be you me and the little hemingway bing
chandler|what he is my favourite author
monica|name one of his books
chandler|the firm
monica|ok let us see
monica|uhm okay the turkey is in the oven the stuffing is ready
chandler|you know you always cook this meal all by yourself
chandler|let me help this year
monica|oh chandler that is sweet
monica|but you do not have to do everything doctor phil tells you to do
chandler|serious let me do something just not the turkey or the stuffing nothing high profile
monica|ok let us see
monica|oh the cranberry sauce it is easy to make and no one really cares about it
chandler|tell me more
monica|okay gonna go check on something across the hall
monica|you start by washing these not with soap
chandler|you obviously have not tasted my palmolive potatoes
ross|hey
ross|hey guess what joey has
joey|three tickets to todays rangers game
ross|dude i wanted him to guess
joey|oh
chandler|oh my god
joey|yeah they are great seats too
ross|guess where they are
joey|center ice
ross|did i do something to you
chandler|hmm the games at one
ross|so
chandler|dinner is at four we will never gonna make it back
joey|so we will leave before it is over we will be back in time
chandler|you say that now but it could take us a long time to get back home
chandler|plus joey could get lost and and they could have to page us to go pick him up
joey|dude two times that happened
chandler|look monica has been working hard all day she did not wanna host this thing in the first place we should not go
ross|he is right man
joey|right i guess
joey|alright so see you at four
chandler|okay
chandler|and get ready to taste my very special cranberries
chandler|or should i say
chandler|chanberries
joey|that is some gentle comedy dude
ross|we are still going at the game right
joey|yeah
ross|yeah
other|this is contestant number sixteen rebecca
phoebe|hey
rachel|oh phoebe listen
rachel|well i think we gotta go
rachel|this place is really freaking me out
rachel|been watching this guy over there i do not think he came with a kid
phoebe|we cannot leave now
phoebe|there was this one baby haley who was favourite to win and she got croup so she had to stay home
phoebe|this competition just blew wide open folks
rachel|phoebe i think
rachel|it is just too weird i just saw a one year old running around with pantyhose on
phoebe|oh i know we should have been more prepared
phoebe|it is okay
phoebe|now the way i see it our real competition now is cameron
phoebe|oh my god they just took her sweater off
phoebe|look at those arms
phoebe|hello michelin man
rachel|oh phoebe
rachel|come on
rachel|you know what it is already three of the clock and they have not even gotten to emmas group yet
rachel|we gotta go we got dinner
phoebe|but emmas got what it takes she could go all the way
rachel|phoebe you have to calm down
phoebe|okay
phoebe|rachel the hottest babies in the tri state area are in this room right now
phoebe|i overheard one of the judges say that not one of them holds a candle to emma
rachel|really
phoebe|yeah
rachel|you heard them say that
phoebe|yeah
rachel|all right okay
rachel|alright let us give to these babies something to cry about
phoebe|good
phoebe|oh yay
phoebe|let us get down to business
phoebe|emma needs some makeup
rachel|no what
phoebe|well she is gonna look all washed out next to the other contestants
rachel|no phoebe i am not letting you put makeup on my baby
phoebe|why not
rachel|because i already did
joey|oh bob get off the guy
ross|oh
ross|what a game huh
joey|i know yeah
ross|i cannot believe chandler is missing this
joey|yeah
joey|i am sorry he is not here too but i got to say i am really enjoying nacho chair
ross|yeah probably enjoy it more if you did not keep batting my hand away
joey|ohhhh
joey|these seats are great
ross|i know i know
ross|when i was here for holidays on ice i was sitting so far away michelle kwan could not read my banner
joey|wow hey we had better get going
joey|if we do not leave right now we will be late for dinner
ross|oh but it is a kind game
ross|so we are a little late you know the girls will be there let us stay just for one more goal
joey|i do not know
ross|one more fight
joey|okay
ross|okay
monica|where is everybody
monica|they are forty five minutes late
chandler|i cannot believe they are not here
chandler|i slave and i slave for what
chandler|they have ruined cranberry day
joey|how late are we
ross|forty five minutes
joey|wow
ross|here
joey|okay
joey|rachel and phoebe are already there okay
joey|so they probably started without us
joey|we could just slip in and no one needs to know where we were
ross|you may want to lose the foam finger
joey|oh no no no no no
joey|you just want to put it on your hand
ross|hey
phoebe|oh
joey|you are not at thanksgiving
rachel|no
phoebe|no we are late
rachel|what are you doing here
ross|we are late too
joey|we figured we could be late because you guys were gonna be on time
phoebe|do not point that thing at me tribbiani
ross|so nobodys here
ross|monicas gonna kill us
joey|yeah where were you
ross|yeah yeah what is with the trophy
phoebe|uh we were at the spelling bee
rachel|and i won
ross|you won an adult thanksgiving day spelling bee
rachel|yes
rachel|y e s
rachel|yes
ross|let me see this
ross|grand supreme little darling new york division
rachel|yeah
rachel|that is me
ross|you entered emma into a beauty pageant
phoebe|and it looks like she put makeup on her
joey|wait a second wait a second where have i seen that cowgirl outfit before
ross|i cannot believe this she is our daughter
ross|that you would treat her like some kind of showdog is inexcusable
rachel|she won a thousand dollars
ross|so this is an annual thing
joey|oh
joey|that is alicia mae emorys outfit
phoebe|you guys there are people in there who are not getting any happier
ross|yeah
ross|what are we gonna do
rachel|well i do not know you guys figure it out i got to put emma down for a nap
joey|all right
joey|hey rach while you are in there throw something on alicia mae
phoebe|alright what are we gonna say
ross|ooh we will say that we were mugged
ross|you cannot get mad at someone who is been mugged
phoebe|oh good that is good but you do not look like you were mugged
joey|no
joey|here
ross|hey
monica|do you hear something
chandler|they are out there
monica|ohhh
monica|let me see
monica|oh god i cannot believe this
monica|they are an hour late and they are just staying out there talking
chandler|everything is so distorted
chandler|looks like joey has a giant hand
chandler|which says rangers on it
chandler|they went to the game
monica|oooh
monica|they are in for a world of pain
chandler|ross shirt is torn
monica|oh
monica|they are late and they are sloppy
rachel|alright emma is napping
rachel|what happened to your shirt
ross|i got mugged
ross|and they stole my pocket
phoebe|we are just
phoebe|we are trying to figure out an excuse
phoebe|hey
phoebe|ooh
phoebe|how about this we can say that monica told us 5 of the clock not 4 of the clock
phoebe|that way we are right on time
phoebe|or
phoebe|or we can plant pcp in the apartment and call the cops on her
ross|that would be a good way to get rid of all the pcp we have lying around
rachel|you know what we just say that she said it was 5 of the clock
rachel|we will just act casual
rachel|we are not late we are right on time
ross|we know you are out there
joey|who do you think its from
rachel|oh god
rachel|this is bad
rachel|this is so bad
ross|well let us just go in there and face them
phoebe|well not going in first
phoebe|i bet that vein on monicas forehead is popping like crazy
joey|i hate that thing it is like a
joey|bolt of lightning
rachel|oh hey i have an idea
rachel|why do not we play rock paper scissors and whoever loses goes in first
rachel|ready
joey|ah haah
joey|i win
ross|what is that
joey|that is fire
joey|beats everything
phoebe|oh really
phoebe|does it beat water balloon
joey|ooh
joey|well played phoebe buffay well played
rachel|alright enough enough come on
rachel|let us just all go in at the same time
phoebe|it is locked
ross|wha
ross|oh sure now they lock it but when they are having s x on the couch its like come on in my butt is surprisingly hairy
rachel|alright come on
rachel|alright you guys
rachel|we are so sorry we are late
rachel|please let us in so we can have dinner together
monica|no
monica|everythings cold
monica|the turkeys dried out and the
monica|the stuffing is all soggy
chandler|yeah and there is a bowl of cranberry sauce that
chandler|what happens to cranberry sauce
monica|nothing
monica|it is fine
chandler|oh thank god
ross|come on you guys we are sorry alri
ross|our subway broke down
chandler|that is a lie you went to the game i can see joeys hand
ross|for the love of god take it off
rachel|you guys come on it does not matter why we are late
rachel|we are all here now please let us in so we can have some of your delicious turkey
joey|i had a dream once about a fax machine that did that
monica|that is all the turkey you are gonna get
ross|how are we gonna decide who gets this
joey|water balloon
phoebe|what are we gonna do
phoebe|starving
rachel|oh i just remembered
rachel|we do have something to eat
rachel|monica put something in our oven this morning
phoebe|oh yeah
monica|hey you touch that and you will be sorry
chandler|guys listen to her
chandler|the vein is bigger than ever seen it
rachel|huh
rachel|oh my god it is brussels sprouts
ross|that is worse than no food
chandler|ha ha
chandler|all you got was monicas stinky brussels sprouts
monica|stinky
chandler|please let me stay on this side of the door
rachel|oh i know
rachel|i still have my old key
rachel|we can just unlock the door
phoebe|well i do not know if that is such a good idea
phoebe|they clearly do not want to be with us
rachel|you know what
rachel|i do not want to be with them either but it is thanksgiving and we should not want to be together together
joey|just get in there and make a face to face apology you know
joey|look them in the eye
joey|i know i can get them to forgive us
ross|i do not know
joey|telling ya
joey|i can do it
ross|yeah he can do it
rachel|oh
joey|oh
joey|it all looks so beautiful the turkey the stuffing
chandler|the cranberries
monica|oh
monica|enough
monica|a monkey could have made em
joey|hey listen guys we feel really terrible
chandler|he is doing that weird eye contact thing
chandler|do not look at him do not look at him
joey|come on you guys we want you to know we are very very sorry
joey|right guys
ross|i feel terrible
other|so so sorry
joey|now let us not ruin this day
joey|you worked so hard
joey|let us move past this and try to have a nice meal all together huh
chandler|the floating heads do make a good point
monica|yeah they do seem to feel pretty bad
rachel|so bad
other|so bad
phoebe|so bad
monica|okay okay
monica|you two go get the dessert
monica|and let you in
rachel|dessert
monica|yeah i asked you and phoebe to pick up the pies
monica|you did remember right
phoebe|pies oh we thought you said priiiize
phoebe|here
monica|grand supreme little darling
rachel|congratulatioooons
monica|oh my god
monica|you forgot the pies
monica|well i cannot believe this
monica|you force me to make dinner then you are an hour late and you forget the one little thing that i asked you to do
ross|really girls not cool
chandler|well you manheads are not any better
chandler|you lied about going to the game
chandler|you knew it would make you late and you still went anyway
joey|hey
joey|getting a little tired of this okay
joey|we said we are sorry
joey|it is thanksgiving for petes sakes
joey|a day of forgiveness
ross|it is a day to be thankful
joey|do not make me come up there
monica|it is too late for apologies
joey|fine
joey|let us just go
joey|i do not need your stupid dinner
chandler|that would be a lot more convincing if you were not drooling
rachel|ewww is that what that is
joey|sorry
phoebe|come on you guys let us just do our own thanksgiving
rachel|yeah
rachel|cook
ross|yeah
ross|let us go out
rachel|hey
joey|yeah
joey|you three have a nice thanksgiving
monica|the three of us
joey|yeah
joey|you chan and the vein
joey|ha
joey|oh oh
joey|stuck
monica|joey that is not gonna work
joey|no seriously
joey|really wedged in here
phoebe|pull you through
ross|okay
joey|aaw ahhh aaahhh stop
joey|stop
joey|worried about damaging my head
chandler|a little late for that
joey|alright hurry up you gotta do something
monica|alright well this does not change anything
monica|okay we need to get something to grease the sides of his face
chandler|uhm we have got turkey grease
monica|bring it
joey|i just wanna say that sorry i referred to the vein as a seperate person
monica|here you go
joey|oh that smells good
joey|okay
monica|okay try it
joey|it is not working
monica|alright we are gonna have to unscrew the chain
joey|well hurry i cannot feel my ears
chandler|can you ever feel your ears
joey|interesting
monica|chandler where are your tools
chandler|oh i left them on my bulldozer
chandler|i do not have tools
monica|i do but rachel borrowed them
rachel|i lent them to ross
ross|i gave them to joey
joey|i left them at the park
monica|oh
ross|finding it really hard not to mess with him
phoebe|already stuffed a bunch of brussel sprouts down his pants
ross|nice
monica|okay i have to get that
monica|now when i get back i want you and your friends to be gone
monica|thanksgiving is over
monica|the vein has spoken
joey|it is really starting to hurt
chandler|okay look gonna pull on the door and you guys push as hard as you can
chandler|maybe we can get enough room to wiggle him out okay
chandler|okay so push
phoebe|just a sec
phoebe|we are kind in the middle of something here
joey|ooh
joey|stop putting things down my pants
chandler|come on guys push
joey|yeah
joey|come on
other|push
other|push
other|push
chandler|my cranberries
joey|man got food all over me
chandler|argh
chandler|i cannot believe what you did
chandler|monicas gonna kill you
chandler|look
chandler|look
chandler|look what the
chandler|look what
chandler|look what the floating heads did
monica|i do not care
chandler|what is going on
monica|that was the adoption agency
chandler|and
monica|we are getting a baby
chandler|are you serious
monica|there is a pregnant woman in ohio and she picked us
rachel|so happy for you
monica|this thanksgiving kicks last thanksgivings ass
rachel|to monica and chandler
rachel|and that knocked up girl in ohio
ross|just so happy you guys are finally getting a kid
phoebe|i know
phoebe|have you considered pageanting
monica|i cannot believe they called and we are actually getting a baby
joey|oh i know how you feel
rachel|really
joey|sure
joey|i went through the exact same thing with alicia mae emory
joey|the waiting the wandering
joey|then one day
joey|i get that call from toys r us
joey|she was in stock
chandler|that is the exact same thing
