Phoebe|Phoebe| Oh hey Ross oh I'm so glad someone's here could   you zip me up?
Ross|Ross| sure.
Phoebe|Phoebe| Thank you. Can you believe no-one between my apartment   and here offered to do that for me?
Ross|Ross| people  so why you all dressed   up.
Phoebe|Phoebe| oh umm Mike's picking me up for a date.
Ross|Ross| oh yea now um how is that going, is it getting serious?
Phoebe|Phoebe| oh I dunno I dunno, you know I mean I like him but   am I ready to take my grade a loins off the meat market.
Ross|Ross| you know I really admire your whole dating attitude,   it's so healthy I'm always like is this moving to fast? Is this moving to slow?   Where's this going?
Phoebe|Phoebe| yea you know you are a bit of a drama queen.
Ross|Ross| but you, your so much better off you just go from   guy to guy having fun and never worrying that it terns into anything serious.
Phoebe|Phoebe| I wouldn't say never, you know there's that guy    well what about  ok well there's gotta be someone.
Ross|Ross| There isn't that's what I'm saying. 
Phoebe|Phoebe| Oh my god you're right.
Ross|Ross| I know and yet here you are all ready for the next   date.
Phoebe|Phoebe| I can't believe I never realized this before, I'm   in my thirty's and never been in a long-term relationship oh my god  what's wrong with me.
Ross|Ross| no, no, no there's nothing wrong with you I mean you   don't strike me as the type of person that wants to get married anyway.
Phoebe|Phoebe| I wanna get married 
Ross|Ross| please don't cry because of me pheebs I don't know   what I'm talking about, I've been divorced three times.
Phoebe|Phoebe| least you've been married, OH MY GOD! I wanna trade   lives with Ross 
Mike|Other| Phoebe    what's wrong?
Phoebe|Phoebe| nothing, I'm excited about our date, Mike this is   Ross Geller this is Mike Haaaaa 
Ross|Ross| I'm sorry I didn't catch.
Mike|Other| its Mike Hanagen
Ross|Ross| Oh Ross Geller
Mike|Other| Hey, so are you sure your ready to go.
Phoebe|Phoebe| uh huh  how do I look 
Ross|Ross| do you have a compact in your purse?
Phoebe|Phoebe|  No
Ross|Ross| you look great.
Monica|Monica|: hey Joey
Joey|Joey| Hey, this girl won't turn around and I can't tell   whether she's hot or not, what do you think?
Monica|Monica|: Joey I am not going to objectify woman with you    but if her face is as nice as her ass woah mamma.
Joey|Joey| Alright thanks, Oh hey have you talked to Chandler?
Monica|Monica|: yeah he has to stay in Tulsa this weekend
Joey|Joey| how come?
Monica|Monica|: he has to work, there's some rush on the big  ah damn it one of these days I'm really gonna have to start listening   when he talks about his job.
Joey|Joey| oh why don't you fly out there and surprise him.
Monica|Monica|: maybe I will go  yea will have a second   honeymoon at the Tulsa romana.
Joey|Joey| oh and you know what you should bring the black see-through   teddy with the attached garters. 
Monica|Monica|: how do you know I have one of those?
Joey|Joey| didn't till just now.
Joey|Joey| hot not hot  Hot!
 Hayley|Other| excuse me?
Joey|Joey| I said I think you're hot and now I'm embarrassed.
 Hayley|Other| oh I thought you said Hi.
Joey|Joey| that would've been better, I'll try that Hi I'm Joey.
 Hayley|Other| I'm Hayley.
Joey|Joey| look I don't usually ask out women that I meet in   coffeehouses
 Gunther|Other| HA!
Joey|Joey|  gesundheit
 Hayley|Other| I would love to go out with you.
Joey|Joey| really, great, did I actually ask you?
 Hayley|Other| no that's just where you were going I just figured that I'd help   you out, you don't seem like the kind of guy that does this very a lot.
 Gunther|Other| HA!
Joey|Joey|  seriously Gunther you should see   someone about that cold, if it gets much worse you could DIE! 
Ross|Ross| so how'd the date go?
Phoebe|Phoebe| well it was awful every time I thought about what   you said I started crying.
Ross|Ross| So he hasn't called?
Phoebe|Phoebe| would you call this girl?    thanks-fo-r-a-love-ly-even-ing
Ross|Ross| now I feel terrible this is all my fault.
Phoebe|Phoebe| well you not what you should feel terrible about,   this could have been my serious guy he was sweet and smart and funny. Do you   know how hard it is to meet a guy like that?
Ross|Ross| We are a rare breed.
 Hayley|Other| what a great dinner.
Joey|Joey| yeah and hey thanks again for letting me having that   last piece of cake at the restaurant.
 Hayley|Other|  your welcome again, I'm gonna make some coffee can I get   you anything?
Joey|Joey| do you have any cake?
Joey|Joey|  AWCH! That's why.
Ross|Ross|  Hey Mike sorry   to just drop by like this, can I come in?
Mike|Other| Sure  who are you?
Ross|Ross| I'm Ross, Phoebe's friend from the coffeehouse.
Mike|Other| Oh.
Ross|Ross| yeah I really, really need to talk to you about something.
Mike|Other| Ok, unless you're not gonna try to get me to join   a cult are you?
Ross|Ross|  No
Mike|Other| oh it's just you have that look 
Ross|Ross| Damn super cuts!
Mike|Other| what's up is Phoebe ok?
Ross|Ross| oh no yeah, no Phoebe is great, but umm I'm an idiot   look right before you guys went out I accidentally got her all upset.
Mike|Other| that's why she was weird.
Ross|Ross| yes, yeah I said something stupid about her never   having had a serious relationship, but you should know she is so much fun,   a wonderful person please don't blow her off.
Mike|Other| I'm not blowing her off, I actually just got off the   phone with her, were going out tomorrow night, I mean I hope that's ok with   you stranger from the coffee house.
Ross|Ross| well then I didn't need to bother you or the four   other Mike Hanagens I bothered.
Mike|Other| hey wait wait wait wait wait! Is that true what you   said Phoebe's never had a serious relationship?
Ross|Ross| of course she has. if she'd never had a serious relationship   I'd go round broadcasting it like some unstoppable moron.
Mike|Other| but you did say it
Ross|Ross| yes, yes I did. and I will also say what I'm about   to say Vis-à-vis the following Phoebe has never had a serious relationship   since her. super-serious relationship with. Vicrum.
Mike|Other| Vicrum?
Ross|Ross| WHAT THAT'S A REAL NAME!
Chandler|Chandler|  Oklahoma where the wind comes   sweeping down the plane, STOP IT! Why couldn't they have sent me to Texas?   7 o clock maybe I'll hit the gym  who am I kidding pay-per-view   porn.
Chandler|Chandler| DO NOT DISTURB DO NOT DISTURB! Monica: 
Monica|Monica|: is everything all right?
Chandler|Chandler| everything's great, just watching some regular   television there, what a pleasant surprise. 
Monica|Monica|: I'm gonna go freshen up ok
Chandler|Chandler| Ok honey. that was close.
Rachel|Rachel| Hello
Monica|Monica|: Hey Rach its me ok I just got the Chandler's room   and I caught him molesting himself.
Rachel|Rachel| Oh that couldn't have been pretty. but you know   guys do that.
Monica|Monica|: yea well the weird part is... he was getting off   to a shark attack show!
Rachel|Rachel| Nooooooooo!
Monica|Monica|: Yes! Chandler Watches Shark Porn!
Rachel|Rachel| well watching sharks? Are you sure that's what he   was doing?
Monica|Monica|: do you know how many times I've seen him jump up   like that, believe me I know what he was doing.
Rachel|Rachel| man sharks. I always knew there was something weird   about that dude. But you promised to love him no matter what.
Monica|Monica|: what means if he gets like a disease or kills someone.   not if he gets his jollys to jaws!
Rachel|Rachel| Ah! You know what honey guys are just different,   they like things that we can't understand, you know I once dated this guy who   wanted to pretend he was an archeologist and I was a naughty cave woman that   he unfroze from a block of ice.
Monica|Monica|: Eww are you talking about my bother.
Rachel|Rachel| yeah I didn't disguise that very well did i.
Joey|Joey|  Hey
Rachel|Rachel|  Hi
Joey|Joey| listen to this... I went out with this girl last night   and half way through our date I realized I already slept with her.
Rachel|Rachel| so basically you've slept with all the woman in   New York and now you're just going around again.
Joey|Joey| well that's not even the weird part. I don't think   she remembered sleeping with me.
Monica|Monica|: But you don't remember sleeping with her.
Joey|Joey| yeah but she should remember sleeping with me I am   very memorable, you guys know.
Rachel|Rachel| what, how do we know, we never slept with you.
Joey|Joey| and who's fault is that.
Monica|Monica|: what's the big deal, you forgot, she forgot, maybe   you were having an off night
Joey|Joey| HEY! I never have an off night ok although sometimes   when I'm a little bloated I don't feel very sexy BUT EVEN THEN I'M BETTER THEN   MOST!
Monica|Monica|: Honey why don't you just let it go and ask her   out again.
Rachel|Rachel| yeah your both so slutty you don't even remember   who you've slept with, you're made for each other.
Joey|Joey| Interesting. all right I'll go out with her again   and try to get past it  OH SALT BLOATY!
Monica|Monica|: Joey, Joey.
Joey|Joey| What?
Monica|Monica|: you don't think sharks are sexy do you?
Joey|Joey| No.  wait a minute what was the little mermaid?
Phoebe|Phoebe| It's open.
Ross|Ross| Hey!
Phoebe|Phoebe| HEY! Mike called were going out again! YAY! YAY!   
Ross|Ross| YAY!  quick thing, I went to talk to Mike.
Phoebe|Phoebe| What? Wha-wha-wha-did you do ROSS!
Ross|Ross| oh boy you got mad at that part. I went over there   to tell him how great you are but you know me BLAH, BLAH, BLAH, and I ended   up telling him that.
Phoebe|Phoebe| WHAT!
Ross|Ross| umm. that you had a six year long relationship with   a guy named Vicrum.
Phoebe|Phoebe| WHAT! WHY?
Ross|Ross| well he seemed to bum hard that you'd never been in   a serious relationship.
Phoebe|Phoebe|  If you hadn't just had a baby   with my best friend I swear to Lucifer a raber dog would be feasting on your   danglers RIGHT NOW!
Ross|Ross| well Phoebe, I think you'll feel better when you know   a little bit about Vicrum, His a Kite designer  and he   used to date Oprah. 
Phoebe|Phoebe| I'm not going along with some lie you made Ross,   No I'm just gonna be honest with him.
Ross|Ross| Good yeah just be honest with him.
Phoebe|Phoebe| yeah I've nothing to be ashamed of ok so I haven't   been in a relationship that lasted longer then a month. Ok I haven't had a   real boyfriend you know if he can't handle that he can leave. which he will   and that's ok. so I'll just be alone forever you know alright I'll be. it'll   be fine. it'll be fine. I'll go walking tours with widows and lesbians. Oh   
Ross|Ross| I'll get it
Phoebe|Phoebe| ok
Mike|Other|  You know I'm trying to think   of the last time I opened a door and you weren't there, Phoebe are you ok?   
Phoebe|Phoebe| Uh huh yeah  there's just something umm,   there's something you should know  Vicrum just called.
 Hayley|Other| so it was kind of a shock after 25 years of marriage my parents,   a perfect couple getting divorced, I kinda took it the hardest cause I was   the youngest.
Joey|Joey| Uh huh, sure, yeah. How can you not remember me?
 Hayley|Other| What?
Joey|Joey| How could you not remember that we slept together?
 Hayley|Other| What! When?
Joey|Joey| I dunno!
 Hayley|Other| I really, really think I would remember sleeping with you
Joey|Joey| come on, come on, search your brain all right. it   was  a certain amount of time ago, I was here you were here, we had   sex  here, here, here NOT there. Anything?
 Hayley|Other| no it's not ringing any bells.
Joey|Joey| my god woman! How many people do you have to had been   with not to remember any of this?
 Hayley's roommate|Other| Hey Hayley you've really gotta fix that doorknob. Joey!
Joey|Joey| Ooooooooooh, I slept with you! And you obviously remember   me Hey! I still got it.  so were good.  I'll let myself out.
Phoebe|Phoebe| .and I said Vicrum you can't just call every time   you get lonely you know, you, you gave up that right when you slept with Rachel.
Mike|Other| But Rachel I thought she just had a baby with Ross
Phoebe|Phoebe| yeah well  yeah you know Emma's birth certificate   might say Geller but her eyes say Mookurgee.
Mike|Other| that is so wrong and on top of that his a glue sniffer.
Phoebe|Phoebe| I know but he call's and my heart goes to him. You   know that bastard is one smooth talking free lance kite designer.
Mike|Other| I just think there's somebody better out there for   you,  I mean I'm not saying me but. maybe me.
Phoebe|Phoebe| Oh.
Mike|Other| and you don't have to worry about glue sniffing with   me. although I do smell the occasional magic marker, yeah ah anyway I just   think I can make you happy.
Phoebe|Phoebe| ok I can't do this.
Mike|Other| what's wrong?
Phoebe|Phoebe| well there is no Vicrum, Ross made him up because   I never really have been in a long-term relationship, I've never lived with   a guy, and I've never even celebrated an anniversary so.  if that's   too weird for you and you wanna leave I totally understand. In fact I'll close   my eye's make it less awkward  You kissed me.
Mike|Other| uh huh
Phoebe|Phoebe| so you don't think I'm a total freak
Mike|Other| No. well look can I think your weird and also cool   for telling me the truth and also wanna kiss you.
Phoebe|Phoebe| I guess so, can I. can I think it's cool that you   kiss me and also wanna kiss you again  and umm, be a little concerned about the magic markers.
Mike|Other| Definitely
Ross|Ross|  This is Vicrum.
Chandler|Chandler| Hi honey I'm home!
Monica|Monica|: Hi, how was your flight? 
Chandler|Chandler| oh it was great.
Monica|Monica|: Here why don't you sit down, get yourself comfortable   because I.  have   a little surprise for you.
Chandler|Chandler| well, well, well it must be five in Tulsa because   it's six o clock IN NY.C!
Monica|Monica|: Ok  This is how much I love   you. 
Chandler|Chandler|  Honey why am I watching   a bunch of sharks swimming around.
Monica|Monica|: Is this not the good part? Do you want me to fast   forward to something a little toothier.
Chandler|Chandler| no I'm not quite sure you got the right movie   that's all.
Monica|Monica|: Oh well this is the only one they had at our video   store, but they did have something called crocodile killers. Or does it always   have to be sharks?
Chandler|Chandler| does what always have to be sharks.
Monica|Monica|: Honey look we can do something else, do you want   me to get into the tub and thrash.
Chandler|Chandler| What's going on?
Monica|Monica|: sweetie it's ok, I still love you, let me be a   part of this.
Chandler|Chandler| let ME be a part of this!
Monica|Monica|: I saw what you were doing in Tulsa. angry sharks   turn you on!
Chandler|Chandler| no they don't
Monica|Monica|: then why were you watching them and giving YOURSELF   a treat.
Chandler|Chandler| OH MY GOD! When you came in I switched the channel,   I was just watching regular porn
Monica|Monica|: really?
Chandler|Chandler| yeah just some good old fashion girl on girl American   action.
Monica|Monica|: I cannot tell you how happy that makes me! 
Chandler|Chandler| You are an amazing wife.  No really   you're amazing you were actually gonna do this for me, I mean where do you   find the strength and understanding over something like that.
Monica|Monica|: Im very, very drunk right now.
Joey|Joey|  see ordinarily I would talk   to her, but my confidence is shaken did I sleep with her? Did I not sleep with   her?
 Phoebe|Other| you know maybe this is a wake up call, about your     whole dating attitude. Your in your thirty's and you've never had a serious     relationship and you have never been in a long term relationship, here you     go from woman to woman, meaningless experience to meaningless experience     never even worrying that it doesn't tern into anything serious.
Joey|Joey| your right! I love my life!  I actually did sleep with   her.
