Joey| Yes! Yes!! And every time you look at it, I want you to remember that you are a good person. Okay, you’ve had the chance to cheat, and with me, but you didn’t. And that’s what this ring stands for.
Rachel| But I thought that ring stood for Caprice’s undying love for her brother.
Joey| Look, do you want the ring or not?!
Rachel| Yeah!
Ross| Hey!
Joey| Hey!
Ross| Look at you! You’re up!
Joey| All right!
Phoebe| I thought I’d try to take a walk. Would you pour me some water? I’ll be back soon.
Joey| Whoa-whoa-whoa! You’re not gonna use the pay phone to call work, are ya?
Phoebe| No. I’ve learned my lesson.
Phoebe| Let’s go! Come on! Move it!  Come on!  Shoes! Briefcase!  Thanks Lou, good luck with the gall bladder. 
Ross| Hey Joe did… Did you ever have a threesome?
Joey|  Well uh, look Ross I uh, I think Carol’s great and I’m sure you’re a very attractive man, but I….
Ross| No! The reason I’m asking is that… I sorta had one last night.
Joey| You?
Ross| Yeah!
Joey| Wow!
Ross| Yeah!
Joey| All right! So, was it amazing?
Ross| It was, it was okay.
Joey| Just okay—Did you do it right?!
Ross|" Look, it’s just did, did you ever go to a party and think, ""Would really anyone miss me if I weren’t here?"""
Joey| Huh. But still Ross, you’re worst day with two women, pretty much better than any other day! Y’know what I mean?
Ross| Oh-oh, absolutely!
Ross| It’s just, my part seemed to be over pretty quickly and then, and then there was a lot of waiting around.
Joey| But you got to be with both of them, right?
Ross| Not-not really. Th-th-there was just Carol.
Joey| Not the other one?
Ross| No, she kept kicking me away!
Joey| Yeah, you don’t want that.
Ross| No!
Joey| Well hey, at least you got to see a lot of stuff, right?
Ross| Oh I a lot of stuff!
Joey| You got a little bored?
Ross| A little. Yeah. I made a snack.
Joey| Yeah? What did ya have?
Ross| Just a sandwich. Turkey, a little mustard…
Joey| Sounds good.
Ross| It really was!
Chandler| Hey!
Monica| Hey!
Chandler| Let me tell you about this chick I scored with last night! Oh no wait a minute that was you!
Monica| Hey, check me out, I’m a slut!
Chandler| So you uh, want to do something tonight?
Monica| Oh I can’t. Dr. Roger is coming over again.
Chandler| Oh. Oh right! Right! Because you’re still seeing him and uh, he’s a good guy. I mean, I remember a time when… 
Monica| Are you okay?
Chandler| Yeah! Totally! Totally, and you?
Monica|" Great! It’s so amazing! I mean, last time Dr. Roger came over, I was so nervous, but then after being with you I’m all like, ""Can the doctor see me now?"""
Chandler| I bet he can.
Monica| Y’know, I don’t have an appointment, but I sure could use a physical.  Are you sure you’re okay?
Chandler| Oh yeah! Yeah! Don’t worry about me, I’ll be fine! 
Rachel| Ohh! My God! Barry!!
Barry| You-you-you said you were gonna be away all weekend!
Rachel| Oh that’s right! I’m sorry! I-I am early! Finish! Please!!
Phoebe| Surprise! Look who’s back!
Arthur|
Phoebe| Hey! 
Arthur|
Phoebe| Uh, I don’t think so!
Jack| Phoebe?
Phoebe| Jack!! Hey!
Jack| What are you doing here?
Phoebe| All better! Back to work! Except this clown from research told me I was fired. He should do his research, huh?
Jack| Well, you were fired.
Phoebe| Nu-uh!
Jack| I told that guy who answered your phone.
Phoebe| Oh, okay I didn’t get that message. So this doesn’t count—Anyway, I’ll be in my office.
Jack| Uh, Phoebe you-you don’t have an office.
Phoebe| That’s all right, I’ll work here. This is goo, next to this plant. 
Jack|  Phoebe, listen…
Phoebe| You’re in my office! Look, I have made a lot of cash for this company! Okay? I am talking big bucks! Pesos! Yen! Rubles! You make one little mistake…
Jack| You lost 13 million dollars.
Phoebe| Oh, so this is all about money! Y’know it’s bad enough that—Ow! Oh, you have got to be kidding!
Jack| Are you all right?
Phoebe| I’m having another heart attack!
Jack| What?!
Phoebe| I’m having another heart attack!! Call 9-1-1!!
Jack| Take it easy. 
Phoebe|  Dumbass!
Woman| Hey Pheebs! How’s it going?!
Phoebe| Well, they fired me and I’m having heart attack.
Woman| Wow! Well, welcome back!
Phoebe| Yeah.
Rachel| Hi Ross!
Ross| Hey Rachel.
Rachel| Is Joey Tribbiani here?
Ross| Umm, no.
Rachel| Well, if you see him, will you please tell him that I’m looking for him and that this I am not gonna throw up!
Ross| That-that’s always good news. Are you okay?
Rachel| Me? I’m great! I’m fine! I’m sooo good!! But, you know who’s not great?! Men! You’re a man right Ross?!
Ross| Yeah.
Rachel| Sit down! 
Ross| Okay.  
Rachel| Let me uh, let me ask you something, do wedding vows mean squat to you people?! And why is it that the second we tell you we’re going out of town, bamn there you are in bed with the neighbor’s dog walker?!
Ross| We’re sorry.
Rachel| No seriously! Seriously! What has happened to the sanctity of marriage?
Ross| Didn’t you spend last night at Joey’s?
Rachel| Aw what are you?! A detective?
Ross| Look I-I don’t know what’s going on with you and your husband and what is hopefully an adult dog walker, look can I just say not all men are like that.
Rachel| Oh. 
Ross| Hey! There are some men who will do whatever it takes to make their marriage work! Okay? There are some men who will stand by and-and watch as their wives engage in-in what only can be described as a twosome with some-some woman she barely knows from the gym!
Rachel| Who are these men?
Ross| Men. I guy I know.
Rachel| Well, you might want to tell him it sounds like his wife is  gay.
Ross| She is not…  She’s gay. Oh my God. She is so gay! I can’t believe this.
Rachel| Good day for married people huh?
Ross| I’m sorry your husband cheated on you.
Rachel| I’m sorry your wife is gay. I guess women aren’t that great either.
Ross| Try telling my wife that.
Chandler|  Okay to come in?
Monica| Yeah, come on, eat, whatever you want. Dr. Roger got beeped again.
Chandler| Yeah I know, guess who beeped him?
Monica| What?!
Chandler| I’m the ruptured spleen.  
Monica| Why would you do that?
Chandler| Because you shouldn’t be with him.  You should be with me.
Monica| Really?
Chandler| Yeah! When you were talking about Roger, that was killing me! Look, things like last night they don’t just happen. Y’know? Or at least not to me. Or with the other two women, in the morning y’know I was just lying there and I couldn’t wait to just go hang out with my friends, but with you I always y’know with a friend.
Monica| Chandler!
Chandler|" I know you probably don’t want to go out with me, y’know because I make too many jokes and I’ve never been in a serious relationship and I guess I’m not technically a ""doctor…"""
Monica| There was just one woman, wasn’t there?
Chandler| No, there were two.
Monica| Including me?
Chandler| Oh yeah.
Phoebe| 
