Phoebe|5| No, of course not! I also, you know, prepared a reading . “Sex and the single mother.  Finding your G-spot.
Everybody|0| No, no, no, no, no!
Judy|0| Hello Emma. Happy eighteenth birthday.
Jack|0| Right now that seems so far away, seventeen years.
Judy|0| Yes, you’ll be all grown up by then. We’ll be... Well your    grandfather and I might not be here.
Jack|0| That’s true! This message could becoming to you from beyond the    grave, Emma!
Judy|0| After all, my parents died very young.
Jack|0| And my cholesterol’s off the charts!
Judy|0| Remember, Emma, heart disease kills women too!
Ross |0| Ok, cut! Great. That was... that was    just... yeah!
Rachel|1| Ross, um, don’t forget to get a shot of Emma’s cake. It’s    in a box in the fridge.
Ross|6| Sure.
Rachel|1| Oh, you're gonna love this cake. I got it from a bakery in New Jersey,    Corino’s.
Monica|2| Oh my God, that place has the creamiest frosting! I use to hitchhike    there when I was a kid.
Rachel|1| Well, anyway, they make these great novelty cakes, in all different    shapes, and if you give them a photo, they’ll copy it in icing!
Monica|2| Oh, did you do a picture of Emma?
Rachel|1| Yes! On a cake shaped like a bunny.
Ross|6| Uh, Rach? Does this bakery by any chance also bake erotic cakes? Say    for bachelorette parties?
Rachel|1| Ross, what are you talking about?  oh! Oh my God!    They put my baby’s face on a penis!
Phoebe |0| oh! Now it’s a party!
Rachel|1| Why you guys this isn't funny, all right? If I wanted this cake to    be a disaster I would have baked it myself!
Judy|0| Jack, look at this.
Jack|0| I know what you're thinking Judy, the resemblance is uncanny!
Ross|6| I am this close to tugging on my testicles again.
Rachel |0| No, no, this is not what I ordered.    Ok? I went all the way to New Jersey so that I could have the perfect cake for    my daughter’s birthday and I need a bunny cake, right now!
Ross|6| Ask them if it would be faster if we cut the baby’s face off the    penis, so we can put it on the bunny. . That is a weird sentence!
Rachel|1| Oh! Believe you me! I am going to bring this cake back, I don't even    want it in my home...  Joey, don't touch it!!
Joey|3| I'm so confused!
Rachel|1|  Yes, yes. I still want    my daughters picture, but on a bunny cake. Yellow cake, chocolate frosting with    nuts!
Chandler|4| To be fair this one does have nuts.
Ross|6| Hey Mon, that was really nice of you to loan Rachel your car so she could    go and get the cake.
Monica|2| Oh. So nice of her to pull my hair, 'till I dropped the key! 
Ross|6| Well, you know what? While we're waiting, you guys could tape your message    to Emma for her 18th birthday, huh?  Ok!
Chandler|4| Hi Emma! It's the year 2020. Are you still enjoying your nap?
Monica|2| We're Aunt Monica and uncle Chandler, by the way.   You may not recognize us, because we haven't spoken to your parents in seventeen years!
Chandler|4| We used to be married, but then we missed a weekend away together    and things kind of unraveled. Because of you! Happy Birthday. 
Monica|2| Ross, Rachel promised it would be over by now. We seriously have to    go, if we want to get to Vermont. I called them and the last train leaves in    a half hour.
Phoebe|5| And you know, I have a massage client soon.
Ross|6| You guys, just please.. a little bit longer. I promise, Rachel will be    back with the cake any minute. Monica, remember.. the frosting? huh?
Monica|2| Alright, 5 more minutes.
Ross|6|  Hello?  Oh no! What happened?  Ok ok, where are you? . Ok, I'll be right    there. 
Chandler|4| Was that Emma? Is she up? 
Ross|6| No, Rachel got pulled over for speeding. She forgot    her licence so now I have to bring it to her.
Phoebe|5| Well, if you're leaving, I'm definitely gonna go.
Monica|2| No! Wait! If anybody gets to go.. it's us     We've been complaining the longest!
Ross|6| No, wait ! You guys, no, no, you can't leave! Rachel already feels bad    that the cake's messed up. How do you think she's gonna feel when she comes    back here and all you guys are gone?
Chandler|4| I don't know! You'll tell us on Monday! 
Ross|6| Joey! You're in charge, ok? You make sure nobody leaves! 
Joey|3| Got it!  Hey hey hey!  Where do you think you're going? 
Chandler|4| To the bathroom!
Joey|3| Alright, well the rest of you get comfortable, ok, because we're gonna    be here for a li... Wait a minute, there is a window in there!
Phoebe|5| Oh no! He's not getting away that easy! 
Chandler|4|  What are you doing? Get the hell out of here! 
Joey|3| Well, that one did not have Emma's face on it.
Phoebe|5| No, it did not.
Joey|3| No.
Judy|0| Well, we better get going, it's late. Jack's not allowed to drive at    night anymore. He has trouble staying in his lane.
Jack|0| Last winter I went up on a church lawn and drove right through a manger    scene. The papers thought it was a hate crime.
Judy|0| Anyway, it was lovely seeing you.
Joey|3| Ok!  
Judy|0| Bye... Bye dear.
Joey|3| Nighty-night!
Judy|0| Nighty-night!
Joey|3| Bye, bye.
Phoebe|5| Joey? How could you just let them leave?
Joey|3| Hey, hey, hey, hey! I'm not gonna mess with Jack, he's a great man, he    fought for our country.
Monica|2| No, he didn't! He pretended to be a Quaker to get out of Korea.
Joey|3|  Oh! Well that's it! He's the last one to go. I'm locking you    guys in. 
Chandler|4| You do know, I can just turn them the other way around, right?
Joey|3| Oh! I forgot you used to live here!
Joey|3| Hello?
Estelle|0|  Joey! It's Estelle!
Joey|3| Hey! 
Estelle|0| So, how did your audition go today?
Joey|3|  What audition?
Estelle|0| The one I told you about last week?
Joey|3| What? You never said anything about an audition!
Estelle|0|  Let me start over. I just got a call about an audition.    I think you can still make it. It's down at the Astor Theatre and you need to    have a monologue prepared.
Joey|3| A monologue? I don't have..  I got it.      Aah! so... I'm gonna take off!
Phoebe|5| Wh.. what? No wait, you don't get to leave! I've got a massage client    waiting outside my door any minute!
Monica|2| Yeah, and we've paid for a room, that we're supposed to be in right    now!
Phoebe|5| Well, oh, ok now... Only one of us has to stay with Emma. Ok, and as    the person who realized that, I get to go!
Monica|2| No! no! Let's figure out a fair way to decide who's staying.
Joey|3| Oh! I got it! Ok, everyone pick a number from one to ten. Alright? Whoever    gets the highest number gets to go first.
Monica|2|  Ok, ten.
Joey|3| Okay, Monica picks ten, I call nine! Anyone else?
Phoebe|5| No, lets just draw straws.
Joey|3| Or.. we could flip a coin, and then multiply the..
Chandler|4| I'm begging you stop.
Joey|3| Right.
Monica|2| Ok, how about this: We got wind up toys for Emma for her birthday.    We can make them race, and whoever comes in last, stays!
Phoebe|5|  Yeah!! Let's do that!
Chandler|4|  That sounds more fun than the thing we were going    to do in Vermont! 
Monica|2| Everybody get your toys! 
Phoebe|5| Ok! I want the dolphin!
Chandler|4| Thats a bear.
Phoebe|5| I'm too excited!
Monica|2| Phoebe, you get the bear, uhm, Joey, you get the robot, and Chandler    and I get the dog. Ok, and the race is going to go  from here to here. Now the one who comes    in last, stays!
Joey|3| Ok, ladies and gentlemen, wind your toys! 
Chandler|4| Ok, on your mark... Get set... GO!!!
Phoebe|5| Go! Go!
Joey|3| Come on robot!
Monica|2|  What are you barking at?
Monica|2| Wha... How the hell is that gonna help?
Chandler|4| I bought you. How did I forget that that's all you do?
Joey|3| Way to go robot!
Phoebe|5| Good job Alan!
Joey|3| Hey, good race you guys.
Phoebe|5| Yeah, see you later!
Monica|2| No! No, no... wait! We didn't lose.  The rules clearly    stated that the last one to cross the finish line was the loser. Well, our dog    never crossed the finish line, so technically...
Chandler|4| They left.
 Rachel|0|"  No, there isn't time to go to the bakery. We're just    gonna come home... Everybody left? Alright, well just tell Emma we're gonna    be there as soon as we can.  Bye...  Ross: RACHEL! Rachel: OOH! God! Sorry! Ross:  I can't believe they gave you a ticket. You're such a    good driver.  Rachel: Emma's awake. Ross: Yeah? Rachel: I can't believe this. This is her first birthday. She's awake. We're    not even there. Everybody left. We still have this stupid obscene cake. Ross: Hey, maybe I can fix that, you know. Try to turn it into something else.     Rachel: Oh, why do you even bother? I already ruined her first birthday...    And do you know how important these early experiences are Ross? Very! According    to the back cover of that book that you gave me. Ross: Rach, she's not going to remember this. Rachel:  I guess... Oh, I just had such an idea of what this    day would be like, you know? Emma laughing and everybody gathered around her    cake singing ""Happy Birthday"". Then we would all go into... HEY GET    OUT OF THE ROAD YOU STUPID STUDENT DRIVER!!!  They have to learn! Ross:  Hey! Rachel: What? Ross: It's not bad. Rachel:  Oh my God! Look what... you made it into a    bunny. How did you do that? Ross: Well, I just made these two things uhm... cheeks. And then I split this    to make ears. Rachel: Well, I'm very impressed. Ross: Some can sing, some can dance. I apparently can turn phallic cakes into    woodland creatures.    Monica: Now another way to organise your stuffed animals, is by size. Chandler: I'm sorry, is this a game for Emma or for Monica? Monica: Game? Chandler: Emma, you even know it's your birthday today? You're one! One-year-old,    that's little.  Chandler: Ooh! That's my girl! Monica: That's how old you are. Chandler: Did I teach her that? Did I just... impart wisdom? Monica:  Ooh, I want one... Chandler: Me too...  Chandler: There's no-one around. Why don't we just take this one? Monica: ...and head to Canada! Chandler: I was kidding. Monica: I wasn't. Let's get going!  Phoebe: Hey, are Ross and Rachel back? Chandler: No, not yet. Phoebe: Oh good, I didn't miss the party. Monica: What about your massage client? Phoebe: I just felt so bad, missing this. So I just slipped him a little something,    you know. As long as I'm back in five or six hours, it will be alright.  Joey: Okay, if Ross and Rachel ask, I've been here the whole time. THE WHOLE    TIME!  Joey:  I've been here the whole time! Ross: Joey, we just saw you come in. You ran past us on the stairs. Rachel: I don't care that you left. I'm just glad that you're here. Thanks    you guys! Chandler: Hey, guys! Come on! You gotta see what Emma just did. Rachel: What? Chandler: Emma, how old are you? How old are you today?  Emma: Wo-ish.   Rachel: Oh! Emma, that's right! You're that many! Ross: Oh my God! Our daughter's a genius! Rach, this means... Rachel:  NO, no science camp! Ross: Damnit! I'll put a candle on the cake. Rachel: Oh!... Oh and Emma, look at your stuffed animals lined up so neatly! Monica: Thanks! Ross: Okay, here we go! Emma's first birthday cake... Well hey... well, blow    out the candle. Come on Emma. Chandler: Let's do it, come on!  Ross: What's wrong? Are you okay? Rachel: Oh yeah, nothing! These are happy tears! This is just what I wanted. Phoebe:  Hey, you made it into a bunny. Joey: What is wrong with me. It looked more delicious when it    was a penis.  ENDING CREDITS    Rachel: Okay. Ross: Okay, you ready? Rachel: Yeah. Ross: A-a-and... record. Rachel: Okay.  Hi Emma. Well,    your first birthday is over, and it was really...  Phoebe:  Go, go, go Alan! Run you, hairy bastard!   end    "
Ross|6| RACHEL!
Rachel|1| OOH! God! Sorry!
Ross|6|  I can't believe they gave you a ticket. You're such a    good driver.
Rachel|1| Emma's awake.
Ross|6| Yeah?
Rachel|1| I can't believe this. This is her first birthday. She's awake. We're    not even there. Everybody left. We still have this stupid obscene cake.
Ross|6| Hey, maybe I can fix that, you know. Try to turn it into something else.    
Rachel|1| Oh, why do you even bother? I already ruined her first birthday...    And do you know how important these early experiences are Ross? Very! According    to the back cover of that book that you gave me.
Ross|6| Rach, she's not going to remember this.
Rachel|1|"  I guess... Oh, I just had such an idea of what this    day would be like, you know? Emma laughing and everybody gathered around her    cake singing ""Happy Birthday"". Then we would all go into... HEY GET    OUT OF THE ROAD YOU STUPID STUDENT DRIVER!!!  They have to learn!"
Ross|6|  Hey!
Rachel|1| What?
Ross|6| It's not bad.
Rachel|1|  Oh my God! Look what... you made it into a    bunny. How did you do that?
Ross|6| Well, I just made these two things uhm... cheeks. And then I split this    to make ears.
Rachel|1| Well, I'm very impressed.
Ross|6| Some can sing, some can dance. I apparently can turn phallic cakes into    woodland creatures. 
 Monica|0| Now another way to organise your stuffed animals, is by size. Chandler: I'm sorry, is this a game for Emma or for Monica? Monica: Game? Chandler: Emma, you even know it's your birthday today? You're one! One-year-old,    that's little.  Chandler: Ooh! That's my girl! Monica: That's how old you are. Chandler: Did I teach her that? Did I just... impart wisdom? Monica:  Ooh, I want one... Chandler: Me too...  Chandler: There's no-one around. Why don't we just take this one? Monica: ...and head to Canada! Chandler: I was kidding. Monica: I wasn't. Let's get going!  Phoebe: Hey, are Ross and Rachel back? Chandler: No, not yet. Phoebe: Oh good, I didn't miss the party. Monica: What about your massage client? Phoebe: I just felt so bad, missing this. So I just slipped him a little something,    you know. As long as I'm back in five or six hours, it will be alright.  Joey: Okay, if Ross and Rachel ask, I've been here the whole time. THE WHOLE    TIME!  Joey:  I've been here the whole time! Ross: Joey, we just saw you come in. You ran past us on the stairs. Rachel: I don't care that you left. I'm just glad that you're here. Thanks    you guys! Chandler: Hey, guys! Come on! You gotta see what Emma just did. Rachel: What? Chandler: Emma, how old are you? How old are you today?  Emma: Wo-ish.   Rachel: Oh! Emma, that's right! You're that many! Ross: Oh my God! Our daughter's a genius! Rach, this means... Rachel:  NO, no science camp! Ross: Damnit! I'll put a candle on the cake. Rachel: Oh!... Oh and Emma, look at your stuffed animals lined up so neatly! Monica: Thanks! Ross: Okay, here we go! Emma's first birthday cake... Well hey... well, blow    out the candle. Come on Emma. Chandler: Let's do it, come on!  Ross: What's wrong? Are you okay? Rachel: Oh yeah, nothing! These are happy tears! This is just what I wanted. Phoebe:  Hey, you made it into a bunny. Joey: What is wrong with me. It looked more delicious when it    was a penis.  ENDING CREDITS    Rachel: Okay. Ross: Okay, you ready? Rachel: Yeah. Ross: A-a-and... record. Rachel: Okay.  Hi Emma. Well,    your first birthday is over, and it was really...  Phoebe:  Go, go, go Alan! Run you, hairy bastard!   end    
Chandler|4| I'm sorry, is this a game for Emma or for Monica?
Monica|2| Game?
Chandler|4| Emma, you even know it's your birthday today? You're one! One-year-old,    that's little.
Chandler|4| Ooh! That's my girl!
Monica|2| That's how old you are.
Chandler|4| Did I teach her that? Did I just... impart wisdom?
Monica|2|  Ooh, I want one...
Chandler|4| Me too...
Chandler|4| There's no-one around. Why don't we just take this one?
Monica|2| ...and head to Canada!
Chandler|4| I was kidding.
Monica|2| I wasn't. Let's get going!
Phoebe|5| Hey, are Ross and Rachel back?
Chandler|4| No, not yet.
Phoebe|5| Oh good, I didn't miss the party.
Monica|2| What about your massage client?
Phoebe|5| I just felt so bad, missing this. So I just slipped him a little something,    you know. As long as I'm back in five or six hours, it will be alright.
Joey|3| Okay, if Ross and Rachel ask, I've been here the whole time. THE WHOLE    TIME!
Joey|3|  I've been here the whole time!
Ross|6| Joey, we just saw you come in. You ran past us on the stairs.
Rachel|1| I don't care that you left. I'm just glad that you're here. Thanks    you guys!
Chandler|4| Hey, guys! Come on! You gotta see what Emma just did.
Rachel|1| What?
Chandler|4| Emma, how old are you? How old are you today? 
Emma|0| Wo-ish. 
Rachel|1| Oh! Emma, that's right! You're that many!
Ross|6| Oh my God! Our daughter's a genius! Rach, this means...
Rachel|1|  NO, no science camp!
Ross|6| Damnit! I'll put a candle on the cake.
Rachel|1| Oh!... Oh and Emma, look at your stuffed animals lined up so neatly!
Monica|2| Thanks!
Ross|6| Okay, here we go! Emma's first birthday cake... Well hey... well, blow    out the candle. Come on Emma.
Chandler|4| Let's do it, come on!
Ross|6| What's wrong? Are you okay?
Rachel|1| Oh yeah, nothing! These are happy tears! This is just what I wanted.
Phoebe|5|  Hey, you made it into a bunny.
Joey|3| What is wrong with me. It looked more delicious when it    was a penis. 
Rachel|1| Okay. Ross: Okay, you ready? Rachel: Yeah. Ross: A-a-and... record. Rachel: Okay.  Hi Emma. Well,    your first birthday is over, and it was really...  Phoebe:  Go, go, go Alan! Run you, hairy bastard!   end    
Ross|6| Okay, you ready?
Rachel|1| Yeah.
Ross|6| A-a-and... record.
Rachel|1| Okay.  Hi Emma. Well,    your first birthday is over, and it was really...
Phoebe|5|  Go, go, go Alan! Run you, hairy bastard! 
