Ross|Ross| Actually this looks like pretty good! Yeah! Boys will be boys?
Phoebe|Phoebe| What? They will be!
Ross|Ross| All right, that’s it, I’m getting out of here.
Rachel|Rachel| No, no, no, no! Ross, wait! Come on! You know, there’s other stuff. Here’s a nice shirt, look at these nice pants...
Ross|Ross| Uh, actually these might look pretty good on me.
Rachel|Rachel| Yes, they will! You know what you should do? Just go take a walk, all right? I know your size and I’m... I’m gonna pick up some really good stuff for you.
Ross|Ross| Really?
Rachel|Rachel| Yes! And I know what looks sexy on guys. Please, just wear what I suggest, and she’s gonna go nuts for you.
Ross|Ross| So, you’re saying, uh, if I wear these pants I might be getting into hers?
Rachel|Rachel|  Why do men keep talking to me like this?
   Chandler|Other|" So, the fact that I am a doctor, and my wife’s a reverend, that’s important to you? Erica: Yeah, I read some great applications, but then I thought “who better then a minister to raise a child!” Monica: Amen. Chandler: Plus I thought the baby would be in good hands with a doctor! Monica: Uh, good hands.  Healing hands. Erica: Reverend, can I ask? Does the bible say anything about adoption? Monica: It says “Do it!”. And behold she did adopt onto them a baby. And it was good. Erica: Wow. Chandler: Yeah, wow. Erica: I was wondering you both have such serious jobs.  Would you have time to take care of a baby and your flock? Monica: Oh, you know, my flock is good, I mean, yeah, my flock pretty much takes care of themselves at this point. Good flock. Flock, flock, flock. Erica:  Being a doctor must take up a lot of time. Chandler: No-ot for me it doesn’t.  Agency guy: So, how’s everything going in here? Erica: We’re great, I think I may have asked all my questions. Agency guy: Do you have any question for Erica? Chandler: Yeah, actually. So, you read a file that you liked and you gave the agency the serial number and they contacted us? Agency guy: Yes, our system assures total anonimity. We’re very proud of it. Chandler: You should be. You’re really on top of stuff.. Agency guy:  Well, then if there’s nothing else, then the two of us should talk. Erica: Actually, I don’t think we have to. Monica: We don’t? Erica: Yeah, when I read about you two, I was pretty sure I wanted you, but I just thought we should meet face to face. . I've made my decision. I choose them. Monica: Oh my God, this is great! This is so great! . Did you hear that? Chandler: Yeah, I did. Monica:  Hey, thank you. Thank you so much. . You are SO going to Heaven!    Rachel: We got some really great stuff! Phoebe: Yeah, yeah but I am not sure about some of the bra's I got. Rachel: Oh! Really? Do you wanna try some of them on for me?  Phoebe: Oh! okay. Wait, are we in Joey's imagination? Rachel:  Oh no! I took one of Ross' bags by     mistake, and one of mine is missing. Phoebe: oh, well, Ross probably has it, you can get it from him later.     Ross:  So? What do you think?  Joey: I think were not wearing the same shirt anymore!! Ross:  Yeah! Yeah! Rachel picked it out for me. She told me to trust her and you know what? I'm glad I did! I turned quite a few heads on my way over here. Joey:  Dude, I really don't think you should be wearing that. Ross: Oh, I see, somebody is afraid of a little competition with the ladies? Joey:  Looks like someone IS the ladies!! Ross: You're just jealous because you couldn't pull this off. Yeah, now if you'll excuse me  I have a date.  See?  ALL eyes on ME!    Chandler: We are NOT signing those papers. Monica: Why not? Chandler: It's wrong. They made a mistake. They think we're somebody else. Monica: God works in mysterious ways. Chandler: You have gotta stop! Monica: But she liked us. Chandler: She likes Doctor Chandler and Reverend Monica. Monica: Well, if you think about it, I am kind of like a Reverend. I mean, as a chef, I serve God, by feeing the hungry and poor.  Chandler: Your Veal Chop is $34,95! Monica: C'mon Chandler, I think we have been given an opportunity. I mean, the mistake has already been made. They are writing up the paper right now. Chandler: But we are not the one she chose! How can you feel okay about this? Monica:  Because... We may not be who she thinks we are but no-one will ever love that baby more than us. Chandler: I know.. Monica: I mean, who knows how long it's gonna take for someone else to give us a baby? What if, what if no one ever picks us? Chandler: oh, honey.. Monica:  Please.. please, we are so close. Chandler: Monica, I want a baby too, but this woman is giving away her child. She deserves to know who it's going to.   Monica:  okay, right.  Chandler: So, we'll tell the truth and who knows, maybe she'll like us for us. Monica:  Maybe she will. Uh! Why couldn't I have been a Reverend? Chandler: You're Jewish. Monica: Technicality!   Waiter: A garden salad for the lady  Joey: Oh, that looks great! Good ordering! Waiter: Seafood platter for the gentleman and extra fries. Enjoy! Sarah: Mmmh, those fries look delicious. Joey: oh, I didn't know you liked French fries. Help yourself! What's mine is yours.  Sarah:  Oh wow, are those stuffed clams? Joey: Uuuh.. yes, they are my stuffed clams.  Joey: How about those fries though, huh?  Sarah: They are delicious  Joey:  You are beautiful, you know that? Sarah: Oh, that is so sweet.. Joey: Oh  okay..   Joey:  NOW look what you did!! Sarah: What? what is the matter with you? Joey: I don't like it when people take food off of my plate, okay? Sarah: But you just said ""What's mine is yours""? Joey: WELL, I DIDN'T MEAN IT! Sarah: Fine, I'm sorry, I didn't think it was that big a deal. Joey: I'm sorry, I'm overreacting. Okay, It's just when it comes to food, I have certain rules, okay, I mean  There are things you do..and you now, things..  that you don't do .      Girl: Wow, this place looks great. Ross: Oh! You are gonna love it!  and I'm so glad, we're finally doing this. Girl: Me too!  Ross: Here  So this was fun!    Joey: I really am sorry about, you know..before. I just want to make sure you know that I really do like you. Sarah: Sure  Just not as much as clams. Joey:  Well, stuffed clams.  Waiter: Chocolate Torte for the lady, cheesecake for the gentleman. Joey: Uh, excuse me sir, there seems to be some sort of red crap on my cheesecake. Waiter: Yes, that's Raspberry coule. Joey:  So stupid, ordering cheesecake, trying to     be healthy.  Sarah:  Oh my God!  Joey: Oh, all right, I'll just have what she's having instead. Waiter: Oh, I'm sorry sir, that was our last piece. Sarah: Mmmm! Mmm!  Sarah: Oh, no! This is work. I should call in. Can you excuse me? Joey: Oh yeah, sure. No problem.  Sarah: What are you doing? I thought you don't share food. Joey: Sure I do.  Coule? Sarah:  No. If I can't have your clams, you can't have my dessert. This is a two way street. Joey:  Really? Sarah: Really! Now this all better be here when I come back.  Joey: Yeah, of course. I can control myself.   Joey:  Stop staring at me!  Joey: Why, just a tiny little...  Joey: Oh-oh! TIME LAPSE  Joey: I'm not even sorry.   Erica: Hi! Adoption Agency guy: Hey. Chandler: Hey. Agency guy: So, these are the preliminary forms for an open adoption. There's a lot to go over, but I'll explain everything as we go through it. Monica:  I-Is... Is that a picture? Erica: Yeah. It's a sonogram they took of the baby last week. I thought you might want to see it.  Monica: Look, doctor!  Look, before we sign anything we really have to talk... We're not who you think we are. Agency guy: I don't understand. Chandler: The agency must have made some mistake. My wife is not a reverend and I'm not a doctor. Erica: What? Agency guy: That's impossible. Chandler: I could perform an operation on you and prove it if you'd like. Agency guy: I'll go check your file. Excuse me. Erica: So who are you? Chandler: Well, our names really are Monica and Chandler. We're from New York. Monica: Yeah, but the important thing to know about us, is how much we would care for this little baby.  Erica: So you lied to me before? Monica: Well, we...  ""bore false witness""... See I could be a reverend. Erica: I can't believe this.  Monica: But we were hoping that since we told you the truth that you still might consider... Erica: Giving you my baby? You think I'd give you my child after this? Monica: Well, you don't have to decide right now, but if you could just look at our file... Erica: I don't want to look at your file! This is over.  Chandler: Erica wait! Erica: I've nothing to say to you.  Chandler: You have every reason to be upset. We did lie. But only because we've been waiting and trying to have a baby for so long. Now we don't know how long it's gonna be before we can get another chance again. Erica: Why don't you ask the reverend to pray on it? Chandler: Erica, please. Just consider us. Ask them to see our file. Our last name's Bing. My wife's a chef and I'm in advertising. Erica: Oh yeah. I actually liked you guys. But it doesn't matter, because what you did was wrong.  Chandler: But you did like us. And you should. My wife's an incredible woman. She's loving and devoted and caring. And don't tell her I said this but the woman's always right... I love my wife more than anything in this world. And I... It kills me that I can't give her a baby... I really want a kid. And when that day finally comes, I'll learn how to be a good dad. But my wife... she's already there. She's a mother... without a baby... Please?  Chandler: You still want that baby?  Monica: God bless you Chandler Bing! COMMERCIAL BREAK  Ross: Turns out this sweater is made for a woman. Joey:  So, why are you still wearing it? Ross: Because it's soft... Hey, so how was your date? Joey: Ooh... Not so good. Ross: Well, looks like it's just the two of us tonight, huh old buddy? Joey: Yeah, and you know what? We could do a lot worse.  Joey:  JOEY DOESN'T SHARE FOOD!  end     "
Chandler|Chandler| So, the fact that I am a doctor, and my wife’s a reverend, that’s important to you?
Erica|Other| Yeah, I read some great applications, but then I thought “who better then a minister to raise a child!”
Monica|Monica| Amen.
Chandler|Chandler| Plus I thought the baby would be in good hands with a doctor!
Monica|Monica| Uh, good hands.  Healing hands.
Erica|Other| Reverend, can I ask? Does the bible say anything about adoption?
Monica|Monica| It says “Do it!”. And behold she did adopt onto them a baby. And it was good.
Erica|Other| Wow.
Chandler|Chandler| Yeah, wow.
Erica|Other| I was wondering you both have such serious jobs.  Would you have time to take care of a baby and your flock?
Monica|Monica| Oh, you know, my flock is good, I mean, yeah, my flock pretty much takes care of themselves at this point. Good flock. Flock, flock, flock.
Erica|Other|  Being a doctor must take up a lot of time.
Chandler|Chandler| No-ot for me it doesn’t.
Agency guy|Other| So, how’s everything going in here?
Erica|Other| We’re great, I think I may have asked all my questions.
Agency guy|Other| Do you have any question for Erica?
Chandler|Chandler| Yeah, actually. So, you read a file that you liked and you gave the agency the serial number and they contacted us?
Agency guy|Other| Yes, our system assures total anonimity. We’re very proud of it.
Chandler|Chandler| You should be. You’re really on top of stuff..
Agency guy|Other|  Well, then if there’s nothing else, then the two of us should talk.
Erica|Other| Actually, I don’t think we have to.
Monica|Monica| We don’t?
Erica|Other| Yeah, when I read about you two, I was pretty sure I wanted you, but I just thought we should meet face to face. . I've made my decision. I choose them.
Monica|Monica| Oh my God, this is great! This is so great! . Did you hear that?
Chandler|Chandler| Yeah, I did.
Monica|Monica|  Hey, thank you. Thank you so much. . You are SO going to Heaven!
 Rachel|Other| We got some really great stuff!
Phoebe|Phoebe| Yeah, yeah but I am not sure about some of the bra's I got.
Rachel|Rachel| Oh! Really? Do you wanna try some of them on for me? 
Phoebe|Phoebe| Oh! okay. Wait, are we in Joey's imagination?
Rachel|Rachel|  Oh no! I took one of Ross' bags by     mistake, and one of mine is missing.
Phoebe|Phoebe| oh, well, Ross probably has it, you can get it from him later.
Ross|Ross|  So? What do you think? 
Joey|Joey| I think were not wearing the same shirt anymore!!
Ross|Ross|  Yeah! Yeah! Rachel picked it out for me. She told me to trust her and you know what? I'm glad I did! I turned quite a few heads on my way over here.
Joey|Joey|  Dude, I really don't think you should be wearing that.
Ross|Ross| Oh, I see, somebody is afraid of a little competition with the ladies?
Joey|Joey|  Looks like someone IS the ladies!!
Ross|Ross| You're just jealous because you couldn't pull this off. Yeah, now if you'll excuse me  I have a date.  See?  ALL eyes on ME!
Chandler|Chandler| We are NOT signing those papers.
Monica|Monica| Why not?
Chandler|Chandler| It's wrong. They made a mistake. They think we're somebody else.
Monica|Monica| God works in mysterious ways.
Chandler|Chandler| You have gotta stop!
Monica|Monica| But she liked us.
Chandler|Chandler| She likes Doctor Chandler and Reverend Monica.
Monica|Monica| Well, if you think about it, I am kind of like a Reverend. I mean, as a chef, I serve God, by feeing the hungry and poor. 
Chandler|Chandler| Your Veal Chop is $34,95!
Monica|Monica| C'mon Chandler, I think we have been given an opportunity. I mean, the mistake has already been made. They are writing up the paper right now.
Chandler|Chandler| But we are not the one she chose! How can you feel okay about this?
Monica|Monica|  Because... We may not be who she thinks we are but no-one will ever love that baby more than us.
Chandler|Chandler| I know..
Monica|Monica| I mean, who knows how long it's gonna take for someone else to give us a baby? What if, what if no one ever picks us?
Chandler|Chandler| oh, honey..
Monica|Monica|  Please.. please, we are so close.
Chandler|Chandler| Monica, I want a baby too, but this woman is giving away her child. She deserves to know who it's going to.   Monica:  okay, right. 
Chandler|Chandler| So, we'll tell the truth and who knows, maybe she'll like us for us.
Monica|Monica|  Maybe she will. Uh! Why couldn't I have been a Reverend?
Chandler|Chandler| You're Jewish.
Monica|Monica| Technicality!
Waiter|Other| A garden salad for the lady 
Joey|Joey| Oh, that looks great! Good ordering!
Waiter|Other| Seafood platter for the gentleman and extra fries. Enjoy!
Sarah|Other| Mmmh, those fries look delicious.
Joey|Joey| oh, I didn't know you liked French fries. Help yourself! What's mine is yours. 
Sarah|Other|  Oh wow, are those stuffed clams?
Joey|Joey| Uuuh.. yes, they are my stuffed clams.
Joey|Joey| How about those fries though, huh? 
Sarah|Other| They are delicious 
Joey|Joey|  You are beautiful, you know that?
Sarah|Other| Oh, that is so sweet..
Joey|Joey| Oh  okay.. 
Joey|Joey|  NOW look what you did!!
Sarah|Other| What? what is the matter with you?
Joey|Joey| I don't like it when people take food off of my plate, okay?
Sarah|Other|" But you just said ""What's mine is yours""?"
Joey|Joey| WELL, I DIDN'T MEAN IT!
Sarah|Other| Fine, I'm sorry, I didn't think it was that big a deal.
Joey|Joey| I'm sorry, I'm overreacting. Okay, It's just when it comes to food, I have certain rules, okay, I mean  There are things you do..and you now, things..  that you don't do . 
Girl|Other| Wow, this place looks great.
Ross|Ross| Oh! You are gonna love it!  and I'm so glad, we're finally doing this.
Girl|Other| Me too! 
Ross|Ross| Here  So this was fun! 
Joey|Joey| I really am sorry about, you know..before. I just want to make sure you know that I really do like you.
Sarah|Other| Sure  Just not as much as clams.
Joey|Joey|  Well, stuffed clams.
Waiter|Other| Chocolate Torte for the lady, cheesecake for the gentleman.
Joey|Joey| Uh, excuse me sir, there seems to be some sort of red crap on my cheesecake.
Waiter|Other| Yes, that's Raspberry coule.
Joey|Joey|  So stupid, ordering cheesecake, trying to     be healthy. 
Sarah|Other|  Oh my God! 
Joey|Joey| Oh, all right, I'll just have what she's having instead.
Waiter|Other| Oh, I'm sorry sir, that was our last piece.
Sarah|Other| Mmmm! Mmm!
Sarah|Other| Oh, no! This is work. I should call in. Can you excuse me?
Joey|Joey| Oh yeah, sure. No problem.
Sarah|Other| What are you doing? I thought you don't share food.
Joey|Joey| Sure I do.  Coule?
Sarah|Other|  No. If I can't have your clams, you can't have my dessert. This is a two way street.
Joey|Joey|  Really?
Sarah|Other| Really! Now this all better be here when I come back. 
Joey|Joey| Yeah, of course. I can control myself. 
Joey|Joey|  Stop staring at me!
Joey|Joey| Why, just a tiny little...
Joey|Joey| Oh-oh!
Joey|Joey| I'm not even sorry.
Erica|Other| Hi!
Adoption Agency guy|Other| Hey.
Chandler|Chandler| Hey.
Agency guy|Other| So, these are the preliminary forms for an open adoption. There's a lot to go over, but I'll explain everything as we go through it.
Monica|Monica|  I-Is... Is that a picture?
Erica|Other| Yeah. It's a sonogram they took of the baby last week. I thought you might want to see it. 
Monica|Monica| Look, doctor!
Agency guy|Other| I don't understand.
Chandler|Chandler| The agency must have made some mistake. My wife is not a reverend and I'm not a doctor.
Erica|Other| What?
Agency guy|Other| That's impossible.
Chandler|Chandler| I could perform an operation on you and prove it if you'd like.
Agency guy|Other| I'll go check your file. Excuse me.
Erica|Other| So who are you?
Chandler|Chandler| Well, our names really are Monica and Chandler. We're from New York.
Monica|Monica| Yeah, but the important thing to know about us, is how much we would care for this little baby. 
Erica|Other| So you lied to me before?
Monica|Monica|" Well, we...  ""bore false witness""... See I could be a reverend."
Erica|Other| I can't believe this. 
Monica|Monica| But we were hoping that since we told you the truth that you still might consider...
Erica|Other| Giving you my baby? You think I'd give you my child after this?
Monica|Monica| Well, you don't have to decide right now, but if you could just look at our file...
Erica|Other| I don't want to look at your file! This is over.
Chandler|Chandler| Erica wait!
Erica|Other| I've nothing to say to you. 
Chandler|Chandler| You have every reason to be upset. We did lie. But only because we've been waiting and trying to have a baby for so long. Now we don't know how long it's gonna be before we can get another chance again.
Erica|Other| Why don't you ask the reverend to pray on it?
Chandler|Chandler| Erica, please. Just consider us. Ask them to see our file. Our last name's Bing. My wife's a chef and I'm in advertising.
Erica|Other| Oh yeah. I actually liked you guys. But it doesn't matter, because what you did was wrong. 
Chandler|Chandler| But you did like us. And you should. My wife's an incredible woman. She's loving and devoted and caring. And don't tell her I said this but the woman's always right... I love my wife more than anything in this world. And I... It kills me that I can't give her a baby... I really want a kid. And when that day finally comes, I'll learn how to be a good dad. But my wife... she's already there. She's a mother... without a baby... Please?
Chandler|Chandler| You still want that baby?
Monica|Monica| God bless you Chandler Bing!
Ross|Ross| Turns out this sweater is made for a woman.
Joey|Joey|  So, why are you still wearing it?
Ross|Ross| Because it's soft... Hey, so how was your date?
Joey|Joey| Ooh... Not so good.
Ross|Ross| Well, looks like it's just the two of us tonight, huh old buddy?
Joey|Joey| Yeah, and you know what? We could do a lot worse.
Joey|Joey|  JOEY DOESN'T SHARE FOOD!
