<p><b>Monica:</b> Something went wrong with Underdog, and they couldn't get his head to inflate. So anyway, um, his head is like flopping down Broadway, right, and I'm just thinking... how inappropriate this is. Um, I've got something in my eye, uh, Joey, could we check it in the light, please? </p>|Monica|2| Something went wrong with Underdog, and they couldn't get his head to inflate. So anyway, um, his head is like flopping down Broadway, right, and I'm just thinking... how inappropriate this is. Um, I've got something in my eye, uh, Joey, could we check it in the light, please? 
<p><b>Monica:</b> Oh my god.</p>|Monica|2| Oh my god.
<p><b>Joey:</b> What?</p>|Joey|3| What?
<p><b>Monica:</b> Hello! Were we at the same table? It's like... cocktails in Appalachia.</p>|Monica|2| Hello! Were we at the same table? It's like... cocktails in Appalachia.
<p><b>Joey:</b> Come on, they're close.</p>|Joey|3| Come on, they're close.
<p><b>Monica:</b> Close? She's got her tongue in his ear.</p>|Monica|2| Close? She's got her tongue in his ear.
<p><b>Joey:</b> Oh, like you've never gotten a little rambunctious with Ross.</p>|Joey|3| Oh, like you've never gotten a little rambunctious with Ross.
<p><b>Monica:</b> Joey, this is sick, it's disgusting, it's, it's—not really true, is it?</p>|Monica|2| Joey, this is sick, it's disgusting, it's, it's—not really true, is it?
<p><b>Joey:</b> Well, who's to say what's true? I mean...</p>|Joey|3| Well, who's to say what's true? I mean...
<p><b>Monica:</b> Oh my god, what were you thinking?</p>|Monica|2| Oh my god, what were you thinking?
<p><b>Joey:</b> All right, look, I'm not proud of this, ok? Well, maybe I am a little.</p>|Joey|3| All right, look, I'm not proud of this, ok? Well, maybe I am a little.
<p><b>Monica:</b>  Oh! </p>|Monica|2|  Oh! 
<p><b>Joey:</b> Ow!</p>|Joey|3| Ow!
<p><b>Monica:</b>  I'm outta here.</p>|Monica|2|  I'm outta here.
<p><b>Joey:</b> Wait, wait, wait. You want him, I want her. He likes you.</p>|Joey|3| Wait, wait, wait. You want him, I want her. He likes you.
<p><b>Monica:</b> Really?</p>|Monica|2| Really?
<p><b>Joey:</b> Yeah. I'm thinking, if we put our heads together, between the two of us, we can break them up.</p>|Joey|3| Yeah. I'm thinking, if we put our heads together, between the two of us, we can break them up.
<p><b>Monica:</b> I'm so sorry, I can't believe I did this, but I couldn't stop laughing at your Norman Mailer story.</p>|Monica|2| I'm so sorry, I can't believe I did this, but I couldn't stop laughing at your Norman Mailer story.
<p><b>Joey:</b> Uh, waiter, one more plate of chicken wings over here.</p>|Joey|3| Uh, waiter, one more plate of chicken wings over here.
<p><b>Chandler:</b> Here's the thing, Janice. You know, I mean, it's like we're different. I'm like the bing, bing, bing. You're like the boom, boom, ... boom.</p>|Chandler|4| Here's the thing, Janice. You know, I mean, it's like we're different. I'm like the bing, bing, bing. You're like the boom, boom, ... boom.
<p><b>Janice:</b> Ow!</p>|Janice|0| Ow!
<p><b>Chandler:</b> Oh, my god, I'm so sorry. Are you ok?</p>|Chandler|4| Oh, my god, I'm so sorry. Are you ok?
<p><b>Janice:</b> Ow. Um, it's just my lens. It's just my lens. I'll be right back.</p>|Janice|0| Ow. Um, it's just my lens. It's just my lens. I'll be right back.
<p><b>Chandler:</b>  I hit her in the eye! I hit her in the eye! This is the worst break-up in the history of the world. </p>|Chandler|4|  I hit her in the eye! I hit her in the eye! This is the worst break-up in the history of the world. 
<p><b>Phoebe:</b> Oh my god.  How many of those have you had?</p>|Phoebe|5| Oh my god.  How many of those have you had?
<p><b>Chandler:</b> Oh, I don't know, a million?</p>|Chandler|4| Oh, I don't know, a million?
<p><b>Phoebe:</b> Chandler, easy, easy. Go to your happy place. La la la la la la la.</p>|Phoebe|5| Chandler, easy, easy. Go to your happy place. La la la la la la la.
<p><b>Chandler:</b> I'm fine.</p>|Chandler|4| I'm fine.
<p><b>Phoebe:</b> All right. </p>|Phoebe|5| All right. 
<p><b>Chandler:</b> I'm not fine. Here she comes.</p>|Chandler|4| I'm not fine. Here she comes.
<p><b>Phoebe:</b> Wait here. Breathe.</p>|Phoebe|5| Wait here. Breathe.
<p><b>Chandler:</b> How do you do that?</p>|Chandler|4| How do you do that?
<p><b>Phoebe:</b> It's like a gift.</p>|Phoebe|5| It's like a gift.
<p><b>Chandler:</b> We should always always break up together.</p>|Chandler|4| We should always always break up together.
<p><b>Phoebe:</b> Oh, I'd like that.</p>|Phoebe|5| Oh, I'd like that.
<p><b>Ross:</b> You got the clothes clean. Now that's the important part.</p>|Ross|6| You got the clothes clean. Now that's the important part.
<p><b>Rachel:</b> Oh, I guess. Except everything looks like jammies now.</p>|Rachel|1| Oh, I guess. Except everything looks like jammies now.
<p><b>Rachel:</b> Whoa, I'm sorry. Excuse me. We had this cart.</p>|Rachel|1| Whoa, I'm sorry. Excuse me. We had this cart.
<p><b>Woman:</b> Yeah, well, I had a 24-inch waist. You lose things. Now come on, get outta my way.</p>|Woman|0| Yeah, well, I had a 24-inch waist. You lose things. Now come on, get outta my way.
<p><b>Rachel:</b> I'm sorry, you know, maybe I wasn't being clear. Uh, this is our cart.</p>|Rachel|1| I'm sorry, you know, maybe I wasn't being clear. Uh, this is our cart.
<p><b>Woman:</b> Hey, hey, hey there aren't any clothes in it.</p>|Woman|0| Hey, hey, hey there aren't any clothes in it.
<p><b>Rachel:</b> Hey, hey, hey, hey, quit making up rules!</p>|Rachel|1| Hey, hey, hey, hey, quit making up rules!
<p><b>Woman:</b> Let go!</p>|Woman|0| Let go!
<p><b>Rachel:</b> All right, listen, missy. If you want this cart, you're gonna have to take me with it! </p>|Rachel|1| All right, listen, missy. If you want this cart, you're gonna have to take me with it! 
<p><b>Rachel:</b>  Yes! Did you see that?</p>|Rachel|1|  Yes! Did you see that?
<p><b>Ross:</b> You were incredible! Brand new woman, ladies and gentlemen.</p>|Ross|6| You were incredible! Brand new woman, ladies and gentlemen.
<p><b>Rachel:</b> I could not have done this without you.</p>|Rachel|1| I could not have done this without you.
<p><b>Ross:</b> Ok, um, uh, more clothes in the dryer?  I'm fine, I'm fine.</p>|Ross|6| Ok, um, uh, more clothes in the dryer?  I'm fine, I'm fine.
<p><b>Rachel:</b> Are you sure?</p>|Rachel|1| Are you sure?
<p><b>Ross:</b> No.</p>|Ross|6| No.
<p><b>Rachel:</b> Oh, are you sure you're ok?</p>|Rachel|1| Oh, are you sure you're ok?
<p><b>Ross:</b> Yeah.</p>|Ross|6| Yeah.
<p><b>Rachel:</b> Does it still hurt?</p>|Rachel|1| Does it still hurt?
<p><b>Ross:</b> Yeah.</p>|Ross|6| Yeah.
<p><b>Phoebe:</b>  What a neat idea. All your clothes match. I'm gonna do this.</p>|Phoebe|5|  What a neat idea. All your clothes match. I'm gonna do this.
<p><b>Monica:</b> Hi.</p>|Monica|2| Hi.
<p><b>Phoebe:</b> Hey, how'd it go?</p>|Phoebe|5| Hey, how'd it go?
<p><b>Joey:</b> Excellent.</p>|Joey|3| Excellent.
<p><b>Monica:</b> We ripped that couple apart, and kept the pieces for ourselves.</p>|Monica|2| We ripped that couple apart, and kept the pieces for ourselves.
<p><b>Ross:</b> What a beautiful story. Hey, I'm fine by the way.</p>|Ross|6| What a beautiful story. Hey, I'm fine by the way.
<p><b>Monica:</b>  Oh, I'm sorry.</p>|Monica|2|  Oh, I'm sorry.
<p><b>Rachel:</b> Where's Chandler?</p>|Rachel|1| Where's Chandler?
<p><b>Phoebe:</b> Oh, he needed some time to grieve.</p>|Phoebe|5| Oh, he needed some time to grieve.
<p><b>Chandler:</b> I'm free! I'm free!</p>|Chandler|4| I'm free! I'm free!
<p><b>Phoebe:</b> That oughta do it.</p>|Phoebe|5| That oughta do it.
