Rachel|1|Ow ow ow|ow ow ow
Phoebe|5|: Yeah, um|yeah um
Phoebe|5|You know you, you should just forget about what I said under the bridge, I was talkin' crazy that night, I was so drunk|you know you you should just forget about what i said under the bridge i was talkin crazy that night i was so drunk
Joey|3|You don't drink|you do not drink
Phoebe|5|That's right, I don't|that is right i do not
Phoebe|5|But I was, I was drunk on you|but i was i was drunk on you
Joey|3|Oh, Urse|oh urse
Phoebe|5|Okay, yeah, so it's not gonna work|okay yeah so it is not gonna work
Joey|3|Why|why
Joey|3|Is it because I'm friends with Phoebe|is it because i am friends with phoebe
Phoebe|5|If it was, would you stop hanging out with her|if it was would you stop hanging out with her
Joey|3|no|no
Joey|3|No, I, I couldn't do that|no i i could not do that
Phoebe|5|Um, then yes, it's 'cause of Phoebe|um then yes it is because of phoebe
Phoebe|5|So, you know, it's either her or me|so you know it is either her or me
Joey|3|Then, uh, then I'm sorry|then uh then i am sorry
Phoebe|5|You know|you know
Phoebe|5|You're gonna be really, really hard to get over|you are gonna be really really hard to get over
Joey|3|I know|i know
Joey|3|I don't know whether it's just 'cause we're breakin' up or|i do not know whether it is just because we are breakin up or
Joey|3|what, but you have never looked so beautiful|what but you have never looked so beautiful
Phoebe|5|Really|really
Joey|3|Pheebs|pheebs
Phoebe|5|Yeah|yeah
Phoebe|5|Oooh|oooh
Ross|6|He looks so tiny|he looks so tiny
Joey|3|We just got the message|we just got the message
Phoebe|5|Is he alright|is he alright
Ross|6|Yeah|yeah
Ross|6|The doctor got the 'K' out|the doctor got the k out
Ross|6|He also found an 'M' and an 'O'|he also found an m and an o
Chandler|4|We think he was trying to spell out 'MONKEY|we think he was trying to spell out monkey
Chandler|4|'|
Ross|6|Well, the doctor says he's gonna be fine, he's just sleeping now|well the doctor says he is gonna be fine he is just sleeping now
Chandler|4|So, you feel like a dad yet|so you feel like a dad yet
Ross|6|No, why|no why
Chandler|4|Hey, come on, you came through, you did what you had to do|hey come on you came through you did what you had to do
Chandler|4|That is very dad|that is very dad
Monica|2|Oh, look, he's waking up|oh look he is waking up
Ross|6|hey, fella|hey fella
Ross|6|How you doing|how you doing
Ross|6|Aqui está|aqui está
Monica|2|¿A quién pidio el pollo General Tso|a quién pidio el pollo general tso
Chandler|4|¡Pudo aver sido General Tso|pudo aver sido general tso
Rachel|1|¡Mira, mira, el viejo desnudo está haciendo el hula hoop|mira mira el viejo desnudo está haciendo el hula hoop
Joey|3|¡Hola, amigos|hola amigos
Monica|2|Mira, Ross, Marcel se llevo el control remoto|mira ross marcel se llevo el control remoto
Ross|6|¡Lo que sucedio es que no le gusta la tele|lo que sucedio es que no le gusta la tele
